[
  {
    "record_uid": "2018-1-r2",
    "source_file": "פילוח קרבנות אלימות ופשיעה בחברה הערבית - 2018.csv",
    "source_row_number": 2,
    "dataset_year": 2018,
    "serial_number": "1",
    "record_group": "Main",
    "included_in_main_tally": true,
    "case_number": "1",
    "victim_name_he": "סולטאן אבו קרדוד",
    "victim_name_ar": "",
    "age": 49,
    "age_group": "40-49",
    "gender_raw": "גבר",
    "gender": "Male",
    "citizen_raw": "",
    "citizen_status": "Unknown",
    "religion": "",
    "residence_locality": "ביר הדאג׳",
    "residence_locality_type": "",
    "residence_population_type": "",
    "geographic_area": "דרום",
    "geographic_area_alt": "נגב",
    "district_state": "",
    "district_police": "",
    "event_date_raw": "9.1.2018",
    "event_date_iso": "2018-01-09",
    "death_date_raw": "9.1",
    "death_date_iso": "2018-01-09",
    "month_raw": "1",
    "month_num": 1,
    "incident_location": "",
    "exact_location": "",
    "solved_raw": "",
    "solved_status": "Unknown",
    "police_status": "",
    "weapon_raw": "ירי",
    "weapon_type": "Firearm",
    "weapon_detail": "",
    "firearm_involved": "Yes",
    "intent_raw": "",
    "background": "",
    "description": "",
    "notes": "",
    "source_url_1": "",
    "source_url_2": ""
  },
  {
    "record_uid": "2018-2-r3",
    "source_file": "פילוח קרבנות אלימות ופשיעה בחברה הערבית - 2018.csv",
    "source_row_number": 3,
    "dataset_year": 2018,
    "serial_number": "2",
    "record_group": "Main",
    "included_in_main_tally": true,
    "case_number": "2",
    "victim_name_he": "סאמר עואד",
    "victim_name_ar": "",
    "age": 33,
    "age_group": "30-39",
    "gender_raw": "גבר",
    "gender": "Male",
    "citizen_raw": "",
    "citizen_status": "Unknown",
    "religion": "",
    "residence_locality": "יפיע",
    "residence_locality_type": "",
    "residence_population_type": "",
    "geographic_area": "צפון",
    "geographic_area_alt": "גליל",
    "district_state": "",
    "district_police": "",
    "event_date_raw": "4.1.2018",
    "event_date_iso": "2018-01-04",
    "death_date_raw": "4.1.18",
    "death_date_iso": "2018-01-04",
    "month_raw": "1",
    "month_num": 1,
    "incident_location": "יפיע",
    "exact_location": "",
    "solved_raw": "",
    "solved_status": "Solved/Indicted",
    "police_status": "הוגש כתב אישום",
    "weapon_raw": "סכין",
    "weapon_type": "Sharp Object",
    "weapon_detail": "",
    "firearm_involved": "No",
    "intent_raw": "",
    "background": "",
    "description": "",
    "notes": "",
    "source_url_1": "https://news.walla.co.il/item/3565293",
    "source_url_2": ""
  },
  {
    "record_uid": "2018-3-r4",
    "source_file": "פילוח קרבנות אלימות ופשיעה בחברה הערבית - 2018.csv",
    "source_row_number": 4,
    "dataset_year": 2018,
    "serial_number": "3",
    "record_group": "Main",
    "included_in_main_tally": true,
    "case_number": "3",
    "victim_name_he": "אסעד אמארה",
    "victim_name_ar": "",
    "age": 35,
    "age_group": "30-39",
    "gender_raw": "גבר",
    "gender": "Male",
    "citizen_raw": "",
    "citizen_status": "Unknown",
    "religion": "",
    "residence_locality": "זלפה",
    "residence_locality_type": "",
    "residence_population_type": "",
    "geographic_area": "משולש צפוני",
    "geographic_area_alt": "משולש",
    "district_state": "",
    "district_police": "",
    "event_date_raw": "12.1.2018",
    "event_date_iso": "2018-01-12",
    "death_date_raw": "12.1",
    "death_date_iso": "2018-01-12",
    "month_raw": "1",
    "month_num": 1,
    "incident_location": "זלפה",
    "exact_location": "",
    "solved_raw": "",
    "solved_status": "Solved/Indicted",
    "police_status": "הוגש כתב אישום",
    "weapon_raw": "ירי",
    "weapon_type": "Firearm",
    "weapon_detail": "",
    "firearm_involved": "Yes",
    "intent_raw": "",
    "background": "",
    "description": "",
    "notes": "",
    "source_url_1": "",
    "source_url_2": ""
  },
  {
    "record_uid": "2018-4-r5",
    "source_file": "פילוח קרבנות אלימות ופשיעה בחברה הערבית - 2018.csv",
    "source_row_number": 5,
    "dataset_year": 2018,
    "serial_number": "4",
    "record_group": "Main",
    "included_in_main_tally": true,
    "case_number": "4",
    "victim_name_he": "קוסאי סולטאן",
    "victim_name_ar": "",
    "age": 34,
    "age_group": "30-39",
    "gender_raw": "גבר",
    "gender": "Male",
    "citizen_raw": "",
    "citizen_status": "Unknown",
    "religion": "",
    "residence_locality": "טירה",
    "residence_locality_type": "",
    "residence_population_type": "",
    "geographic_area": "משולש דרומי",
    "geographic_area_alt": "משולש",
    "district_state": "",
    "district_police": "",
    "event_date_raw": "26.1.2018",
    "event_date_iso": "2018-01-26",
    "death_date_raw": "26.1",
    "death_date_iso": "2018-01-26",
    "month_raw": "1",
    "month_num": 1,
    "incident_location": "טירה",
    "exact_location": "",
    "solved_raw": "",
    "solved_status": "Unknown",
    "police_status": "כנראה על רקע פלילי",
    "weapon_raw": "ירי",
    "weapon_type": "Firearm",
    "weapon_detail": "",
    "firearm_involved": "Yes",
    "intent_raw": "",
    "background": "",
    "description": "",
    "notes": "",
    "source_url_1": "",
    "source_url_2": ""
  },
  {
    "record_uid": "2018-5-r6",
    "source_file": "פילוח קרבנות אלימות ופשיעה בחברה הערבית - 2018.csv",
    "source_row_number": 6,
    "dataset_year": 2018,
    "serial_number": "5",
    "record_group": "Main",
    "included_in_main_tally": true,
    "case_number": "5",
    "victim_name_he": "מוסטפא אבו סיף אלאטארש",
    "victim_name_ar": "",
    "age": 50,
    "age_group": "50-64",
    "gender_raw": "גבר",
    "gender": "Male",
    "citizen_raw": "",
    "citizen_status": "Unknown",
    "religion": "",
    "residence_locality": "חורה",
    "residence_locality_type": "",
    "residence_population_type": "",
    "geographic_area": "דרום",
    "geographic_area_alt": "נגב",
    "district_state": "",
    "district_police": "",
    "event_date_raw": "29.1.2018",
    "event_date_iso": "2018-01-29",
    "death_date_raw": "29.1",
    "death_date_iso": "2018-01-29",
    "month_raw": "1",
    "month_num": 1,
    "incident_location": "לוד",
    "exact_location": "",
    "solved_raw": "",
    "solved_status": "Unknown",
    "police_status": "",
    "weapon_raw": "ירי",
    "weapon_type": "Firearm",
    "weapon_detail": "",
    "firearm_involved": "Yes",
    "intent_raw": "",
    "background": "",
    "description": "",
    "notes": "",
    "source_url_1": "",
    "source_url_2": ""
  },
  {
    "record_uid": "2018-6-r7",
    "source_file": "פילוח קרבנות אלימות ופשיעה בחברה הערבית - 2018.csv",
    "source_row_number": 7,
    "dataset_year": 2018,
    "serial_number": "6",
    "record_group": "Main",
    "included_in_main_tally": true,
    "case_number": "6",
    "victim_name_he": "מוחמד חאתם מסארווה",
    "victim_name_ar": "",
    "age": 28,
    "age_group": "25-29",
    "gender_raw": "גבר",
    "gender": "Male",
    "citizen_raw": "",
    "citizen_status": "Unknown",
    "religion": "",
    "residence_locality": "טייבה",
    "residence_locality_type": "",
    "residence_population_type": "",
    "geographic_area": "משולש דרומי",
    "geographic_area_alt": "משולש",
    "district_state": "",
    "district_police": "",
    "event_date_raw": "17.2.2018",
    "event_date_iso": "2018-02-17",
    "death_date_raw": "17.2",
    "death_date_iso": "2018-02-17",
    "month_raw": "2",
    "month_num": 2,
    "incident_location": "טייבה",
    "exact_location": "",
    "solved_raw": "",
    "solved_status": "Unknown",
    "police_status": "מקורב לעד מדינה שהעיד נגד ארגון פשע. נרצח במרכז העיר",
    "weapon_raw": "ירי",
    "weapon_type": "Firearm",
    "weapon_detail": "",
    "firearm_involved": "Yes",
    "intent_raw": "",
    "background": "",
    "description": "",
    "notes": "",
    "source_url_1": "",
    "source_url_2": ""
  },
  {
    "record_uid": "2018-7-r8",
    "source_file": "פילוח קרבנות אלימות ופשיעה בחברה הערבית - 2018.csv",
    "source_row_number": 8,
    "dataset_year": 2018,
    "serial_number": "7",
    "record_group": "Main",
    "included_in_main_tally": true,
    "case_number": "7",
    "victim_name_he": "רביע פריג",
    "victim_name_ar": "",
    "age": 23,
    "age_group": "18-24",
    "gender_raw": "גבר",
    "gender": "Male",
    "citizen_raw": "",
    "citizen_status": "Unknown",
    "religion": "",
    "residence_locality": "כפר קאסם",
    "residence_locality_type": "",
    "residence_population_type": "",
    "geographic_area": "משולש דרומי",
    "geographic_area_alt": "משולש",
    "district_state": "",
    "district_police": "",
    "event_date_raw": "17.3.2018",
    "event_date_iso": "2018-03-17",
    "death_date_raw": "17.3",
    "death_date_iso": "2018-03-17",
    "month_raw": "3",
    "month_num": 3,
    "incident_location": "כפר קאסם",
    "exact_location": "",
    "solved_raw": "",
    "solved_status": "Solved/Indicted",
    "police_status": "הוגש כתב אישום",
    "weapon_raw": "ירי",
    "weapon_type": "Firearm",
    "weapon_detail": "",
    "firearm_involved": "Yes",
    "intent_raw": "",
    "background": "",
    "description": "",
    "notes": "",
    "source_url_1": "https://posta.co.il/article/19045-פוענח-רצח-רביע-פריג-בכפר-קאסם/",
    "source_url_2": ""
  },
  {
    "record_uid": "2018-8-r9",
    "source_file": "פילוח קרבנות אלימות ופשיעה בחברה הערבית - 2018.csv",
    "source_row_number": 9,
    "dataset_year": 2018,
    "serial_number": "8",
    "record_group": "Main",
    "included_in_main_tally": true,
    "case_number": "8",
    "victim_name_he": "מכרם גאבר",
    "victim_name_ar": "",
    "age": 29,
    "age_group": "25-29",
    "gender_raw": "גבר",
    "gender": "Male",
    "citizen_raw": "",
    "citizen_status": "Unknown",
    "religion": "",
    "residence_locality": "טייבה",
    "residence_locality_type": "",
    "residence_population_type": "",
    "geographic_area": "משולש דרומי",
    "geographic_area_alt": "משולש",
    "district_state": "",
    "district_police": "",
    "event_date_raw": "31.3.2018",
    "event_date_iso": "2018-03-31",
    "death_date_raw": "31.3",
    "death_date_iso": "2018-03-31",
    "month_raw": "3",
    "month_num": 3,
    "incident_location": "טייבה",
    "exact_location": "",
    "solved_raw": "",
    "solved_status": "Unknown",
    "police_status": "הרקע לא ברור. נורה מ-30 קליעים",
    "weapon_raw": "ירי",
    "weapon_type": "Firearm",
    "weapon_detail": "",
    "firearm_involved": "Yes",
    "intent_raw": "",
    "background": "",
    "description": "",
    "notes": "",
    "source_url_1": "",
    "source_url_2": ""
  },
  {
    "record_uid": "2018-9-r10",
    "source_file": "פילוח קרבנות אלימות ופשיעה בחברה הערבית - 2018.csv",
    "source_row_number": 10,
    "dataset_year": 2018,
    "serial_number": "9",
    "record_group": "Main",
    "included_in_main_tally": true,
    "case_number": "9",
    "victim_name_he": "ניזאר גהשאן",
    "victim_name_ar": "",
    "age": 56,
    "age_group": "50-64",
    "gender_raw": "גבר",
    "gender": "Male",
    "citizen_raw": "",
    "citizen_status": "Unknown",
    "religion": "",
    "residence_locality": "נצרת",
    "residence_locality_type": "",
    "residence_population_type": "",
    "geographic_area": "צפון",
    "geographic_area_alt": "גליל",
    "district_state": "",
    "district_police": "",
    "event_date_raw": "1.4.2018",
    "event_date_iso": "2018-04-01",
    "death_date_raw": "21.4",
    "death_date_iso": "2018-04-21",
    "month_raw": "4",
    "month_num": 4,
    "incident_location": "נצרת",
    "exact_location": "",
    "solved_raw": "",
    "solved_status": "Unknown",
    "police_status": "הרקע לא ברור",
    "weapon_raw": "ירי",
    "weapon_type": "Firearm",
    "weapon_detail": "",
    "firearm_involved": "Yes",
    "intent_raw": "",
    "background": "",
    "description": "",
    "notes": "",
    "source_url_1": "",
    "source_url_2": ""
  },
  {
    "record_uid": "2018-10-r11",
    "source_file": "פילוח קרבנות אלימות ופשיעה בחברה הערבית - 2018.csv",
    "source_row_number": 11,
    "dataset_year": 2018,
    "serial_number": "10",
    "record_group": "Main",
    "included_in_main_tally": true,
    "case_number": "10",
    "victim_name_he": "מוחמד עבדאלגני סעאדה",
    "victim_name_ar": "",
    "age": 50,
    "age_group": "50-64",
    "gender_raw": "גבר",
    "gender": "Male",
    "citizen_raw": "",
    "citizen_status": "Unknown",
    "religion": "",
    "residence_locality": "אום אלפחם",
    "residence_locality_type": "",
    "residence_population_type": "",
    "geographic_area": "משולש צפוני",
    "geographic_area_alt": "משולש",
    "district_state": "",
    "district_police": "",
    "event_date_raw": "3.4.2018",
    "event_date_iso": "2018-04-03",
    "death_date_raw": "3.4.2018",
    "death_date_iso": "2018-04-03",
    "month_raw": "4",
    "month_num": 4,
    "incident_location": "אום אלפחם",
    "exact_location": "",
    "solved_raw": "",
    "solved_status": "Unknown",
    "police_status": "הרקע לא ברור",
    "weapon_raw": "ירי",
    "weapon_type": "Firearm",
    "weapon_detail": "",
    "firearm_involved": "Yes",
    "intent_raw": "",
    "background": "",
    "description": "",
    "notes": "",
    "source_url_1": "",
    "source_url_2": ""
  },
  {
    "record_uid": "2018-11-r12",
    "source_file": "פילוח קרבנות אלימות ופשיעה בחברה הערבית - 2018.csv",
    "source_row_number": 12,
    "dataset_year": 2018,
    "serial_number": "11",
    "record_group": "Main",
    "included_in_main_tally": true,
    "case_number": "11",
    "victim_name_he": "שפיק אבו מקלד",
    "victim_name_ar": "",
    "age": 48,
    "age_group": "40-49",
    "gender_raw": "גבר",
    "gender": "Male",
    "citizen_raw": "",
    "citizen_status": "Unknown",
    "religion": "",
    "residence_locality": "אום אלפחם",
    "residence_locality_type": "",
    "residence_population_type": "",
    "geographic_area": "משולש צפוני",
    "geographic_area_alt": "משולש",
    "district_state": "",
    "district_police": "",
    "event_date_raw": "18.4.2018",
    "event_date_iso": "2018-04-18",
    "death_date_raw": "18.4",
    "death_date_iso": "2018-04-18",
    "month_raw": "4",
    "month_num": 4,
    "incident_location": "אום אלפחם",
    "exact_location": "",
    "solved_raw": "",
    "solved_status": "Unknown",
    "police_status": "ככל הנראה על רקע של סכסוך בין נערים",
    "weapon_raw": "ירי",
    "weapon_type": "Firearm",
    "weapon_detail": "",
    "firearm_involved": "Yes",
    "intent_raw": "",
    "background": "",
    "description": "",
    "notes": "",
    "source_url_1": "",
    "source_url_2": ""
  },
  {
    "record_uid": "2018-11-r13",
    "source_file": "פילוח קרבנות אלימות ופשיעה בחברה הערבית - 2018.csv",
    "source_row_number": 13,
    "dataset_year": 2018,
    "serial_number": "12",
    "record_group": "Main",
    "included_in_main_tally": true,
    "case_number": "11",
    "victim_name_he": "פרסאן חאלד מקלד אבו עזיז",
    "victim_name_ar": "",
    "age": 13,
    "age_group": "0-17",
    "gender_raw": "גבר",
    "gender": "Male",
    "citizen_raw": "",
    "citizen_status": "Unknown",
    "religion": "",
    "residence_locality": "אום אלפחם",
    "residence_locality_type": "",
    "residence_population_type": "",
    "geographic_area": "משולש צפוני",
    "geographic_area_alt": "משולש",
    "district_state": "",
    "district_police": "",
    "event_date_raw": "18.4.2018",
    "event_date_iso": "2018-04-18",
    "death_date_raw": "18.4",
    "death_date_iso": "2018-04-18",
    "month_raw": "4",
    "month_num": 4,
    "incident_location": "אום אלפחם",
    "exact_location": "",
    "solved_raw": "",
    "solved_status": "Unknown",
    "police_status": "ככל הנראה על רקע של סכסוך בין נערים",
    "weapon_raw": "ירי",
    "weapon_type": "Firearm",
    "weapon_detail": "",
    "firearm_involved": "Yes",
    "intent_raw": "",
    "background": "",
    "description": "",
    "notes": "",
    "source_url_1": "",
    "source_url_2": ""
  },
  {
    "record_uid": "2018-12-r14",
    "source_file": "פילוח קרבנות אלימות ופשיעה בחברה הערבית - 2018.csv",
    "source_row_number": 14,
    "dataset_year": 2018,
    "serial_number": "13",
    "record_group": "Main",
    "included_in_main_tally": true,
    "case_number": "12",
    "victim_name_he": "מוסא מחאמיד",
    "victim_name_ar": "",
    "age": 22,
    "age_group": "18-24",
    "gender_raw": "גבר",
    "gender": "Male",
    "citizen_raw": "",
    "citizen_status": "Unknown",
    "religion": "",
    "residence_locality": "יפו",
    "residence_locality_type": "",
    "residence_population_type": "",
    "geographic_area": "תל אביב-יפו",
    "geographic_area_alt": "ערים מעורבות",
    "district_state": "",
    "district_police": "",
    "event_date_raw": "19.4.2018",
    "event_date_iso": "2018-04-19",
    "death_date_raw": "19.4.18",
    "death_date_iso": "2018-04-19",
    "month_raw": "4",
    "month_num": 4,
    "incident_location": "יפו",
    "exact_location": "",
    "solved_raw": "",
    "solved_status": "Unknown",
    "police_status": "כמה חודשים לפני הרצח נורה בכפר קאסם ונפצע קל.",
    "weapon_raw": "ירי",
    "weapon_type": "Firearm",
    "weapon_detail": "",
    "firearm_involved": "Yes",
    "intent_raw": "",
    "background": "",
    "description": "",
    "notes": "",
    "source_url_1": "",
    "source_url_2": ""
  },
  {
    "record_uid": "2018-13-r15",
    "source_file": "פילוח קרבנות אלימות ופשיעה בחברה הערבית - 2018.csv",
    "source_row_number": 15,
    "dataset_year": 2018,
    "serial_number": "14",
    "record_group": "Main",
    "included_in_main_tally": true,
    "case_number": "13",
    "victim_name_he": "יזיד מואייד הבראת",
    "victim_name_ar": "",
    "age": 26,
    "age_group": "25-29",
    "gender_raw": "גבר",
    "gender": "Male",
    "citizen_raw": "",
    "citizen_status": "Unknown",
    "religion": "",
    "residence_locality": "נעורה",
    "residence_locality_type": "",
    "residence_population_type": "",
    "geographic_area": "צפון",
    "geographic_area_alt": "גליל",
    "district_state": "",
    "district_police": "",
    "event_date_raw": "25.4.2018",
    "event_date_iso": "2018-04-25",
    "death_date_raw": "25.4.18",
    "death_date_iso": "2018-04-25",
    "month_raw": "4",
    "month_num": 4,
    "incident_location": "עפולה",
    "exact_location": "",
    "solved_raw": "",
    "solved_status": "Unknown",
    "police_status": "הרקע לא ברור",
    "weapon_raw": "ירי",
    "weapon_type": "Firearm",
    "weapon_detail": "",
    "firearm_involved": "Yes",
    "intent_raw": "",
    "background": "",
    "description": "",
    "notes": "",
    "source_url_1": "",
    "source_url_2": ""
  },
  {
    "record_uid": "2018-14-r16",
    "source_file": "פילוח קרבנות אלימות ופשיעה בחברה הערבית - 2018.csv",
    "source_row_number": 16,
    "dataset_year": 2018,
    "serial_number": "15",
    "record_group": "Main",
    "included_in_main_tally": true,
    "case_number": "14",
    "victim_name_he": "קרם ממדוח סולטאן",
    "victim_name_ar": "",
    "age": 22,
    "age_group": "18-24",
    "gender_raw": "גבר",
    "gender": "Male",
    "citizen_raw": "",
    "citizen_status": "Unknown",
    "religion": "",
    "residence_locality": "טירה",
    "residence_locality_type": "",
    "residence_population_type": "",
    "geographic_area": "משולש דרומי",
    "geographic_area_alt": "משולש",
    "district_state": "",
    "district_police": "",
    "event_date_raw": "29.4.2018",
    "event_date_iso": "2018-04-29",
    "death_date_raw": "29.4",
    "death_date_iso": "2018-04-29",
    "month_raw": "4",
    "month_num": 4,
    "incident_location": "טירה",
    "exact_location": "",
    "solved_raw": "",
    "solved_status": "Unknown",
    "police_status": "ככל הנראה נורה בגלל טעות בזיהוי. צו איסור פרסום הוטל על החקירה",
    "weapon_raw": "ירי",
    "weapon_type": "Firearm",
    "weapon_detail": "",
    "firearm_involved": "Yes",
    "intent_raw": "",
    "background": "",
    "description": "",
    "notes": "",
    "source_url_1": "",
    "source_url_2": ""
  },
  {
    "record_uid": "2018-15-r17",
    "source_file": "פילוח קרבנות אלימות ופשיעה בחברה הערבית - 2018.csv",
    "source_row_number": 17,
    "dataset_year": 2018,
    "serial_number": "16",
    "record_group": "Main",
    "included_in_main_tally": true,
    "case_number": "15",
    "victim_name_he": "עלי עאמר",
    "victim_name_ar": "",
    "age": 38,
    "age_group": "30-39",
    "gender_raw": "גבר",
    "gender": "Male",
    "citizen_raw": "",
    "citizen_status": "Unknown",
    "religion": "",
    "residence_locality": "כפר קאסם",
    "residence_locality_type": "",
    "residence_population_type": "",
    "geographic_area": "משולש דרומי",
    "geographic_area_alt": "משולש",
    "district_state": "",
    "district_police": "",
    "event_date_raw": "2.5.2018",
    "event_date_iso": "2018-05-02",
    "death_date_raw": "2.5",
    "death_date_iso": "2018-05-02",
    "month_raw": "5",
    "month_num": 5,
    "incident_location": "כפר סבא",
    "exact_location": "",
    "solved_raw": "",
    "solved_status": "Unknown",
    "police_status": "הוגשו כתבי אישום. נאשם בהריגה (חביב מנסור) זוכה מהריגה ונחתם הסדר טיעון עמו",
    "weapon_raw": "מטען חבלה",
    "weapon_type": "Explosive",
    "weapon_detail": "",
    "firearm_involved": "Unknown",
    "intent_raw": "",
    "background": "",
    "description": "",
    "notes": "",
    "source_url_1": "",
    "source_url_2": ""
  },
  {
    "record_uid": "2018-16-r18",
    "source_file": "פילוח קרבנות אלימות ופשיעה בחברה הערבית - 2018.csv",
    "source_row_number": 18,
    "dataset_year": 2018,
    "serial_number": "17",
    "record_group": "Main",
    "included_in_main_tally": true,
    "case_number": "16",
    "victim_name_he": "זובידה מנסור",
    "victim_name_ar": "",
    "age": 19,
    "age_group": "18-24",
    "gender_raw": "אישה",
    "gender": "Female",
    "citizen_raw": "",
    "citizen_status": "Unknown",
    "religion": "",
    "residence_locality": "טירה",
    "residence_locality_type": "",
    "residence_population_type": "",
    "geographic_area": "משולש דרומי",
    "geographic_area_alt": "משולש",
    "district_state": "",
    "district_police": "",
    "event_date_raw": "13.5.2018",
    "event_date_iso": "2018-05-13",
    "death_date_raw": "13.5",
    "death_date_iso": "2018-05-13",
    "month_raw": "5",
    "month_num": 5,
    "incident_location": "טירה",
    "exact_location": "",
    "solved_raw": "",
    "solved_status": "Unknown",
    "police_status": "לא נעצרו חשודים. צו איסור פרסום",
    "weapon_raw": "ירי",
    "weapon_type": "Firearm",
    "weapon_detail": "",
    "firearm_involved": "Yes",
    "intent_raw": "",
    "background": "",
    "description": "",
    "notes": "",
    "source_url_1": "",
    "source_url_2": ""
  },
  {
    "record_uid": "2018-17-r19",
    "source_file": "פילוח קרבנות אלימות ופשיעה בחברה הערבית - 2018.csv",
    "source_row_number": 19,
    "dataset_year": 2018,
    "serial_number": "18",
    "record_group": "Main",
    "included_in_main_tally": true,
    "case_number": "17",
    "victim_name_he": "אכרם אבו עאמר",
    "victim_name_ar": "",
    "age": 18,
    "age_group": "18-24",
    "gender_raw": "גבר",
    "gender": "Male",
    "citizen_raw": "",
    "citizen_status": "Unknown",
    "religion": "",
    "residence_locality": "רמלה",
    "residence_locality_type": "",
    "residence_population_type": "",
    "geographic_area": "מרכז",
    "geographic_area_alt": "ערים מעורבות",
    "district_state": "",
    "district_police": "",
    "event_date_raw": "13.5.2018",
    "event_date_iso": "2018-05-13",
    "death_date_raw": "16.5",
    "death_date_iso": "2018-05-16",
    "month_raw": "5",
    "month_num": 5,
    "incident_location": "רמלה",
    "exact_location": "",
    "solved_raw": "",
    "solved_status": "Solved/Indicted",
    "police_status": "הוגש כתב אישום נגד אמין אבו עאמר. האירוע קרה במהלך סולחה",
    "weapon_raw": "ירי",
    "weapon_type": "Firearm",
    "weapon_detail": "",
    "firearm_involved": "Yes",
    "intent_raw": "",
    "background": "",
    "description": "",
    "notes": "",
    "source_url_1": "",
    "source_url_2": ""
  },
  {
    "record_uid": "2018-18-r20",
    "source_file": "פילוח קרבנות אלימות ופשיעה בחברה הערבית - 2018.csv",
    "source_row_number": 20,
    "dataset_year": 2018,
    "serial_number": "19",
    "record_group": "Main",
    "included_in_main_tally": true,
    "case_number": "18",
    "victim_name_he": "ראמי פטאירגי",
    "victim_name_ar": "",
    "age": 22,
    "age_group": "18-24",
    "gender_raw": "גבר",
    "gender": "Male",
    "citizen_raw": "",
    "citizen_status": "Unknown",
    "religion": "",
    "residence_locality": "יפו",
    "residence_locality_type": "",
    "residence_population_type": "",
    "geographic_area": "תל אביב-יפו",
    "geographic_area_alt": "ערים מעורבות",
    "district_state": "",
    "district_police": "",
    "event_date_raw": "13.5.2018",
    "event_date_iso": "2018-05-13",
    "death_date_raw": "13.5",
    "death_date_iso": "2018-05-13",
    "month_raw": "5",
    "month_num": 5,
    "incident_location": "יפו",
    "exact_location": "",
    "solved_raw": "",
    "solved_status": "Unknown",
    "police_status": "ככל הנראה רצח על רקע סכסוך בין עבריינים",
    "weapon_raw": "ירי",
    "weapon_type": "Firearm",
    "weapon_detail": "",
    "firearm_involved": "Yes",
    "intent_raw": "",
    "background": "",
    "description": "",
    "notes": "",
    "source_url_1": "",
    "source_url_2": ""
  },
  {
    "record_uid": "2018-19-r21",
    "source_file": "פילוח קרבנות אלימות ופשיעה בחברה הערבית - 2018.csv",
    "source_row_number": 21,
    "dataset_year": 2018,
    "serial_number": "20",
    "record_group": "Main",
    "included_in_main_tally": true,
    "case_number": "19",
    "victim_name_he": "יוסף מחאמיד",
    "victim_name_ar": "",
    "age": 22,
    "age_group": "18-24",
    "gender_raw": "גבר",
    "gender": "Male",
    "citizen_raw": "",
    "citizen_status": "Unknown",
    "religion": "",
    "residence_locality": "אום אלפחם",
    "residence_locality_type": "",
    "residence_population_type": "",
    "geographic_area": "משולש צפוני",
    "geographic_area_alt": "משולש",
    "district_state": "",
    "district_police": "",
    "event_date_raw": "16.5.2018",
    "event_date_iso": "2018-05-16",
    "death_date_raw": "16.5",
    "death_date_iso": "2018-05-16",
    "month_raw": "5",
    "month_num": 5,
    "incident_location": "אום אלפחם",
    "exact_location": "",
    "solved_raw": "",
    "solved_status": "Unknown",
    "police_status": "",
    "weapon_raw": "ירי",
    "weapon_type": "Firearm",
    "weapon_detail": "",
    "firearm_involved": "Yes",
    "intent_raw": "",
    "background": "",
    "description": "",
    "notes": "",
    "source_url_1": "",
    "source_url_2": ""
  },
  {
    "record_uid": "2018-20-r22",
    "source_file": "פילוח קרבנות אלימות ופשיעה בחברה הערבית - 2018.csv",
    "source_row_number": 22,
    "dataset_year": 2018,
    "serial_number": "21",
    "record_group": "Main",
    "included_in_main_tally": true,
    "case_number": "20",
    "victim_name_he": "נורית מלוק",
    "victim_name_ar": "",
    "age": 21,
    "age_group": "18-24",
    "gender_raw": "אישה",
    "gender": "Female",
    "citizen_raw": "",
    "citizen_status": "Unknown",
    "religion": "",
    "residence_locality": "יפו",
    "residence_locality_type": "",
    "residence_population_type": "",
    "geographic_area": "תל אביב-יפו",
    "geographic_area_alt": "ערים מעורבות",
    "district_state": "",
    "district_police": "",
    "event_date_raw": "17.5.2018",
    "event_date_iso": "2018-05-17",
    "death_date_raw": "17.5",
    "death_date_iso": "2018-05-17",
    "month_raw": "5",
    "month_num": 5,
    "incident_location": "יפו",
    "exact_location": "",
    "solved_raw": "",
    "solved_status": "Solved/Indicted",
    "police_status": "כתב אישום הוגש בחודש יוני 2018 נגד פאדי מלוק, אח שלהן אשר המתין לגזר דינו בגין איומים על אחת מהן",
    "weapon_raw": "סכין",
    "weapon_type": "Sharp Object",
    "weapon_detail": "",
    "firearm_involved": "No",
    "intent_raw": "",
    "background": "",
    "description": "",
    "notes": "",
    "source_url_1": "",
    "source_url_2": ""
  },
  {
    "record_uid": "2018-20-r23",
    "source_file": "פילוח קרבנות אלימות ופשיעה בחברה הערבית - 2018.csv",
    "source_row_number": 23,
    "dataset_year": 2018,
    "serial_number": "22",
    "record_group": "Main",
    "included_in_main_tally": true,
    "case_number": "20",
    "victim_name_he": "חיאת מלוק",
    "victim_name_ar": "",
    "age": 19,
    "age_group": "18-24",
    "gender_raw": "אישה",
    "gender": "Female",
    "citizen_raw": "",
    "citizen_status": "Unknown",
    "religion": "",
    "residence_locality": "יפו",
    "residence_locality_type": "",
    "residence_population_type": "",
    "geographic_area": "תל אביב-יפו",
    "geographic_area_alt": "ערים מעורבות",
    "district_state": "",
    "district_police": "",
    "event_date_raw": "17.5.2018",
    "event_date_iso": "2018-05-17",
    "death_date_raw": "17.5",
    "death_date_iso": "2018-05-17",
    "month_raw": "5",
    "month_num": 5,
    "incident_location": "יפו",
    "exact_location": "",
    "solved_raw": "",
    "solved_status": "Solved/Indicted",
    "police_status": "כתב אישום הוגש בחודש יוני 2018 נגד פאדי מלוק, אח שלהן אשר המתין לגזר דינו בגין איומים על אחת מהן",
    "weapon_raw": "סכין",
    "weapon_type": "Sharp Object",
    "weapon_detail": "",
    "firearm_involved": "No",
    "intent_raw": "",
    "background": "",
    "description": "",
    "notes": "",
    "source_url_1": "",
    "source_url_2": ""
  },
  {
    "record_uid": "2018-21-r24",
    "source_file": "פילוח קרבנות אלימות ופשיעה בחברה הערבית - 2018.csv",
    "source_row_number": 24,
    "dataset_year": 2018,
    "serial_number": "23",
    "record_group": "Main",
    "included_in_main_tally": true,
    "case_number": "21",
    "victim_name_he": "זאהי אבו אלקיעאן",
    "victim_name_ar": "",
    "age": 26,
    "age_group": "25-29",
    "gender_raw": "גבר",
    "gender": "Male",
    "citizen_raw": "",
    "citizen_status": "Unknown",
    "religion": "",
    "residence_locality": "חורה",
    "residence_locality_type": "",
    "residence_population_type": "",
    "geographic_area": "דרום",
    "geographic_area_alt": "נגב",
    "district_state": "",
    "district_police": "",
    "event_date_raw": "23.5.2018",
    "event_date_iso": "2018-05-23",
    "death_date_raw": "15.7.18",
    "death_date_iso": "2018-07-15",
    "month_raw": "5",
    "month_num": 5,
    "incident_location": "חורה",
    "exact_location": "",
    "solved_raw": "",
    "solved_status": "Unknown",
    "police_status": "",
    "weapon_raw": "ירי",
    "weapon_type": "Firearm",
    "weapon_detail": "",
    "firearm_involved": "Yes",
    "intent_raw": "",
    "background": "",
    "description": "",
    "notes": "",
    "source_url_1": "",
    "source_url_2": ""
  },
  {
    "record_uid": "2018-22-r25",
    "source_file": "פילוח קרבנות אלימות ופשיעה בחברה הערבית - 2018.csv",
    "source_row_number": 25,
    "dataset_year": 2018,
    "serial_number": "24",
    "record_group": "Main",
    "included_in_main_tally": true,
    "case_number": "22",
    "victim_name_he": "עבד אלסלאם עדבה",
    "victim_name_ar": "",
    "age": 23,
    "age_group": "18-24",
    "gender_raw": "גבר",
    "gender": "Male",
    "citizen_raw": "",
    "citizen_status": "Unknown",
    "religion": "",
    "residence_locality": "קלנסווה",
    "residence_locality_type": "",
    "residence_population_type": "",
    "geographic_area": "משולש דרומי",
    "geographic_area_alt": "משולש",
    "district_state": "",
    "district_police": "",
    "event_date_raw": "27.5.2018",
    "event_date_iso": "2018-05-27",
    "death_date_raw": "27.5.18",
    "death_date_iso": "2018-05-27",
    "month_raw": "5",
    "month_num": 5,
    "incident_location": "קלנסווה",
    "exact_location": "",
    "solved_raw": "",
    "solved_status": "Unknown",
    "police_status": "ככל הנראה הרקע פלילי",
    "weapon_raw": "ירי",
    "weapon_type": "Firearm",
    "weapon_detail": "",
    "firearm_involved": "Yes",
    "intent_raw": "",
    "background": "",
    "description": "",
    "notes": "",
    "source_url_1": "",
    "source_url_2": ""
  },
  {
    "record_uid": "2018-23-r26",
    "source_file": "פילוח קרבנות אלימות ופשיעה בחברה הערבית - 2018.csv",
    "source_row_number": 26,
    "dataset_year": 2018,
    "serial_number": "25",
    "record_group": "Main",
    "included_in_main_tally": true,
    "case_number": "23",
    "victim_name_he": "סמר חטיב",
    "victim_name_ar": "",
    "age": 33,
    "age_group": "30-39",
    "gender_raw": "אישה",
    "gender": "Female",
    "citizen_raw": "",
    "citizen_status": "Unknown",
    "religion": "",
    "residence_locality": "יפו",
    "residence_locality_type": "",
    "residence_population_type": "",
    "geographic_area": "תל אביב-יפו",
    "geographic_area_alt": "ערים מעורבות",
    "district_state": "",
    "district_police": "",
    "event_date_raw": "29.5.2018",
    "event_date_iso": "2018-05-29",
    "death_date_raw": "29.5",
    "death_date_iso": "2018-05-29",
    "month_raw": "5",
    "month_num": 5,
    "incident_location": "ראשון לציון",
    "exact_location": "",
    "solved_raw": "",
    "solved_status": "Unknown",
    "police_status": "הוגשו כתבי אישום במרץ 2019 נגד קרובי משפחתו של בן הזוג שלה",
    "weapon_raw": "ירי",
    "weapon_type": "Firearm",
    "weapon_detail": "",
    "firearm_involved": "Yes",
    "intent_raw": "",
    "background": "",
    "description": "",
    "notes": "",
    "source_url_1": "",
    "source_url_2": ""
  },
  {
    "record_uid": "2018-24-r27",
    "source_file": "פילוח קרבנות אלימות ופשיעה בחברה הערבית - 2018.csv",
    "source_row_number": 27,
    "dataset_year": 2018,
    "serial_number": "26",
    "record_group": "Main",
    "included_in_main_tally": true,
    "case_number": "24",
    "victim_name_he": "פאדיה קדיס",
    "victim_name_ar": "",
    "age": 52,
    "age_group": "50-64",
    "gender_raw": "אישה",
    "gender": "Female",
    "citizen_raw": "",
    "citizen_status": "Unknown",
    "religion": "",
    "residence_locality": "יפו",
    "residence_locality_type": "",
    "residence_population_type": "",
    "geographic_area": "תל אביב-יפו",
    "geographic_area_alt": "ערים מעורבות",
    "district_state": "",
    "district_police": "",
    "event_date_raw": "7.6.2018",
    "event_date_iso": "2018-06-07",
    "death_date_raw": "7.6.18",
    "death_date_iso": "2018-06-07",
    "month_raw": "6",
    "month_num": 6,
    "incident_location": "יפו",
    "exact_location": "",
    "solved_raw": "",
    "solved_status": "Solved/Indicted",
    "police_status": "הוגש כתב אישום בחודש יולי 2018. על פי החשד נרצחה על ידי בתה ובן זוגה של הבת על רקע התנגדותה למערכת היחסים בין השניים, רצח בדקירות",
    "weapon_raw": "סכין",
    "weapon_type": "Sharp Object",
    "weapon_detail": "",
    "firearm_involved": "No",
    "intent_raw": "",
    "background": "",
    "description": "",
    "notes": "",
    "source_url_1": "",
    "source_url_2": ""
  },
  {
    "record_uid": "2018-25-r28",
    "source_file": "פילוח קרבנות אלימות ופשיעה בחברה הערבית - 2018.csv",
    "source_row_number": 28,
    "dataset_year": 2018,
    "serial_number": "27",
    "record_group": "Main",
    "included_in_main_tally": true,
    "case_number": "25",
    "victim_name_he": "מוחמד זיתאוי",
    "victim_name_ar": "",
    "age": 31,
    "age_group": "30-39",
    "gender_raw": "גבר",
    "gender": "Male",
    "citizen_raw": "",
    "citizen_status": "Unknown",
    "religion": "",
    "residence_locality": "זלפה",
    "residence_locality_type": "",
    "residence_population_type": "",
    "geographic_area": "משולש צפוני",
    "geographic_area_alt": "משולש",
    "district_state": "",
    "district_police": "",
    "event_date_raw": "23.6.2018",
    "event_date_iso": "2018-06-23",
    "death_date_raw": "23.6.18",
    "death_date_iso": "2018-06-23",
    "month_raw": "6",
    "month_num": 6,
    "incident_location": "מי עמי (ליד אום אלפחם)",
    "exact_location": "",
    "solved_raw": "",
    "solved_status": "Unknown",
    "police_status": "",
    "weapon_raw": "ירי",
    "weapon_type": "Firearm",
    "weapon_detail": "",
    "firearm_involved": "Yes",
    "intent_raw": "",
    "background": "",
    "description": "",
    "notes": "",
    "source_url_1": "",
    "source_url_2": ""
  },
  {
    "record_uid": "2018-26-r29",
    "source_file": "פילוח קרבנות אלימות ופשיעה בחברה הערבית - 2018.csv",
    "source_row_number": 29,
    "dataset_year": 2018,
    "serial_number": "28",
    "record_group": "Main",
    "included_in_main_tally": true,
    "case_number": "26",
    "victim_name_he": "מוחמד זיאד מגרבי",
    "victim_name_ar": "",
    "age": 25,
    "age_group": "25-29",
    "gender_raw": "גבר",
    "gender": "Male",
    "citizen_raw": "",
    "citizen_status": "Unknown",
    "religion": "",
    "residence_locality": "רמלה",
    "residence_locality_type": "",
    "residence_population_type": "",
    "geographic_area": "מרכז",
    "geographic_area_alt": "ערים מעורבות",
    "district_state": "",
    "district_police": "",
    "event_date_raw": "27.7.2018",
    "event_date_iso": "2018-07-27",
    "death_date_raw": "27.7.18",
    "death_date_iso": "2018-07-27",
    "month_raw": "7",
    "month_num": 7,
    "incident_location": "רמלה",
    "exact_location": "",
    "solved_raw": "",
    "solved_status": "Unknown",
    "police_status": "",
    "weapon_raw": "ירי",
    "weapon_type": "Firearm",
    "weapon_detail": "",
    "firearm_involved": "Yes",
    "intent_raw": "",
    "background": "",
    "description": "",
    "notes": "",
    "source_url_1": "",
    "source_url_2": ""
  },
  {
    "record_uid": "2018-27-r30",
    "source_file": "פילוח קרבנות אלימות ופשיעה בחברה הערבית - 2018.csv",
    "source_row_number": 30,
    "dataset_year": 2018,
    "serial_number": "29",
    "record_group": "Main",
    "included_in_main_tally": true,
    "case_number": "27",
    "victim_name_he": "עודי אבו עמאר",
    "victim_name_ar": "",
    "age": 18,
    "age_group": "18-24",
    "gender_raw": "גבר",
    "gender": "Male",
    "citizen_raw": "",
    "citizen_status": "Unknown",
    "religion": "",
    "residence_locality": "לקיה",
    "residence_locality_type": "",
    "residence_population_type": "",
    "geographic_area": "דרום",
    "geographic_area_alt": "נגב",
    "district_state": "",
    "district_police": "",
    "event_date_raw": "31.7.2018",
    "event_date_iso": "2018-07-31",
    "death_date_raw": "31.7.18",
    "death_date_iso": "2018-07-31",
    "month_raw": "7",
    "month_num": 7,
    "incident_location": "לקיה",
    "exact_location": "",
    "solved_raw": "",
    "solved_status": "Unknown",
    "police_status": "במהלך קטטה בין משפחות, ככל הנראה בגלל סכסוך על אדמות",
    "weapon_raw": "ירי",
    "weapon_type": "Firearm",
    "weapon_detail": "",
    "firearm_involved": "Yes",
    "intent_raw": "",
    "background": "",
    "description": "",
    "notes": "",
    "source_url_1": "",
    "source_url_2": ""
  },
  {
    "record_uid": "2018-28-r31",
    "source_file": "פילוח קרבנות אלימות ופשיעה בחברה הערבית - 2018.csv",
    "source_row_number": 31,
    "dataset_year": 2018,
    "serial_number": "30",
    "record_group": "Main",
    "included_in_main_tally": true,
    "case_number": "28",
    "victim_name_he": "רסמייה מסאלחה",
    "victim_name_ar": "",
    "age": 60,
    "age_group": "50-64",
    "gender_raw": "אישה",
    "gender": "Female",
    "citizen_raw": "",
    "citizen_status": "Unknown",
    "religion": "",
    "residence_locality": "דבוריה",
    "residence_locality_type": "",
    "residence_population_type": "",
    "geographic_area": "צפון",
    "geographic_area_alt": "גליל",
    "district_state": "",
    "district_police": "",
    "event_date_raw": "30.7.2018",
    "event_date_iso": "2018-07-30",
    "death_date_raw": "1.8.18",
    "death_date_iso": "2018-08-01",
    "month_raw": "7",
    "month_num": 7,
    "incident_location": "דבוריה",
    "exact_location": "",
    "solved_raw": "",
    "solved_status": "Unknown",
    "police_status": "לפי החשד נדחפה למותה במהלך ויכוח עם בן משפחה (אחיין), אשר נמלט לאחר המעשה. החשוד נתפש ונעצר בחשד לרצח",
    "weapon_raw": "חבלות",
    "weapon_type": "Other",
    "weapon_detail": "",
    "firearm_involved": "Unknown",
    "intent_raw": "",
    "background": "",
    "description": "",
    "notes": "",
    "source_url_1": "https://www.kul-alarab.com/Article/866715",
    "source_url_2": ""
  },
  {
    "record_uid": "2018-29-r32",
    "source_file": "פילוח קרבנות אלימות ופשיעה בחברה הערבית - 2018.csv",
    "source_row_number": 32,
    "dataset_year": 2018,
    "serial_number": "31",
    "record_group": "Main",
    "included_in_main_tally": true,
    "case_number": "29",
    "victim_name_he": "נורא אבו סלב",
    "victim_name_ar": "",
    "age": 37,
    "age_group": "30-39",
    "gender_raw": "אישה",
    "gender": "Female",
    "citizen_raw": "",
    "citizen_status": "Unknown",
    "religion": "",
    "residence_locality": "חורה",
    "residence_locality_type": "",
    "residence_population_type": "",
    "geographic_area": "דרום",
    "geographic_area_alt": "נגב",
    "district_state": "",
    "district_police": "",
    "event_date_raw": "12.8.2018",
    "event_date_iso": "2018-08-12",
    "death_date_raw": "12.8.18",
    "death_date_iso": "2018-08-12",
    "month_raw": "8",
    "month_num": 8,
    "incident_location": "חורה",
    "exact_location": "",
    "solved_raw": "",
    "solved_status": "Partially Solved",
    "police_status": "לא בוצעו מעצרים בחשד למעשה אולם ידוע כי בעלה לשעבר מרצה מאסר בגין אלימות כלפיה",
    "weapon_raw": "ירי",
    "weapon_type": "Firearm",
    "weapon_detail": "",
    "firearm_involved": "Yes",
    "intent_raw": "",
    "background": "",
    "description": "",
    "notes": "",
    "source_url_1": "",
    "source_url_2": ""
  },
  {
    "record_uid": "2018-30-r33",
    "source_file": "פילוח קרבנות אלימות ופשיעה בחברה הערבית - 2018.csv",
    "source_row_number": 33,
    "dataset_year": 2018,
    "serial_number": "32",
    "record_group": "Main",
    "included_in_main_tally": true,
    "case_number": "30",
    "victim_name_he": "אחמד זוהדי עתאמנה",
    "victim_name_ar": "",
    "age": 40,
    "age_group": "40-49",
    "gender_raw": "גבר",
    "gender": "Male",
    "citizen_raw": "",
    "citizen_status": "Unknown",
    "religion": "",
    "residence_locality": "באקה אל גרביה",
    "residence_locality_type": "",
    "residence_population_type": "",
    "geographic_area": "משולש צפוני",
    "geographic_area_alt": "משולש",
    "district_state": "",
    "district_police": "",
    "event_date_raw": "12.8.2018",
    "event_date_iso": "2018-08-12",
    "death_date_raw": "13.8.18",
    "death_date_iso": "2018-08-13",
    "month_raw": "8",
    "month_num": 8,
    "incident_location": "באקה אל גרביה",
    "exact_location": "",
    "solved_raw": "",
    "solved_status": "Unknown",
    "police_status": "הרקע למקרה לא ברור",
    "weapon_raw": "ירי",
    "weapon_type": "Firearm",
    "weapon_detail": "",
    "firearm_involved": "Yes",
    "intent_raw": "",
    "background": "",
    "description": "",
    "notes": "",
    "source_url_1": "",
    "source_url_2": ""
  },
  {
    "record_uid": "2018-31-r34",
    "source_file": "פילוח קרבנות אלימות ופשיעה בחברה הערבית - 2018.csv",
    "source_row_number": 34,
    "dataset_year": 2018,
    "serial_number": "33",
    "record_group": "Main",
    "included_in_main_tally": true,
    "case_number": "31",
    "victim_name_he": "עבדאללה עומרייה",
    "victim_name_ar": "",
    "age": 21,
    "age_group": "18-24",
    "gender_raw": "גבר",
    "gender": "Male",
    "citizen_raw": "",
    "citizen_status": "Unknown",
    "religion": "",
    "residence_locality": "איבטין",
    "residence_locality_type": "",
    "residence_population_type": "",
    "geographic_area": "צפון",
    "geographic_area_alt": "גליל",
    "district_state": "",
    "district_police": "",
    "event_date_raw": "19.8.2018",
    "event_date_iso": "2018-08-19",
    "death_date_raw": "19.8.18",
    "death_date_iso": "2018-08-19",
    "month_raw": "8",
    "month_num": 8,
    "incident_location": "איבטין",
    "exact_location": "",
    "solved_raw": "",
    "solved_status": "Unknown",
    "police_status": "בחודש אוגוסט 2018 נעצרו 3 חשודים. ככל הנראה נפגע מירי שלא כוון אליו. לא הוגשו כתבי אישום",
    "weapon_raw": "ירי",
    "weapon_type": "Firearm",
    "weapon_detail": "",
    "firearm_involved": "Yes",
    "intent_raw": "",
    "background": "",
    "description": "",
    "notes": "",
    "source_url_1": "https://www.ynet.co.il/articles/0,7340,L-5331687,00.html",
    "source_url_2": ""
  },
  {
    "record_uid": "2018-32-r35",
    "source_file": "פילוח קרבנות אלימות ופשיעה בחברה הערבית - 2018.csv",
    "source_row_number": 35,
    "dataset_year": 2018,
    "serial_number": "34",
    "record_group": "Main",
    "included_in_main_tally": true,
    "case_number": "32",
    "victim_name_he": "מחמוד חגאג",
    "victim_name_ar": "",
    "age": 20,
    "age_group": "18-24",
    "gender_raw": "גבר",
    "gender": "Male",
    "citizen_raw": "",
    "citizen_status": "Unknown",
    "religion": "",
    "residence_locality": "טירה",
    "residence_locality_type": "",
    "residence_population_type": "",
    "geographic_area": "משולש דרומי",
    "geographic_area_alt": "משולש",
    "district_state": "",
    "district_police": "",
    "event_date_raw": "30.8.2018",
    "event_date_iso": "2018-08-30",
    "death_date_raw": "30.8.18",
    "death_date_iso": "2018-08-30",
    "month_raw": "8",
    "month_num": 8,
    "incident_location": "טירה",
    "exact_location": "",
    "solved_raw": "",
    "solved_status": "Unknown",
    "police_status": "התנקשות על רקע עברייני",
    "weapon_raw": "ירי",
    "weapon_type": "Firearm",
    "weapon_detail": "",
    "firearm_involved": "Yes",
    "intent_raw": "",
    "background": "",
    "description": "",
    "notes": "",
    "source_url_1": "",
    "source_url_2": ""
  },
  {
    "record_uid": "2018-33-r36",
    "source_file": "פילוח קרבנות אלימות ופשיעה בחברה הערבית - 2018.csv",
    "source_row_number": 36,
    "dataset_year": 2018,
    "serial_number": "35",
    "record_group": "Main",
    "included_in_main_tally": true,
    "case_number": "33",
    "victim_name_he": "רימה אבו חיט",
    "victim_name_ar": "",
    "age": 19,
    "age_group": "18-24",
    "gender_raw": "אישה",
    "gender": "Female",
    "citizen_raw": "",
    "citizen_status": "Unknown",
    "religion": "",
    "residence_locality": "טירה",
    "residence_locality_type": "",
    "residence_population_type": "",
    "geographic_area": "משולש דרומי",
    "geographic_area_alt": "משולש",
    "district_state": "",
    "district_police": "",
    "event_date_raw": "30.8.2018",
    "event_date_iso": "2018-08-30",
    "death_date_raw": "30.8.18",
    "death_date_iso": "2018-08-30",
    "month_raw": "8",
    "month_num": 8,
    "incident_location": "טירה",
    "exact_location": "",
    "solved_raw": "",
    "solved_status": "Unknown",
    "police_status": "בת הזוג של מחמוד חגאג. נרצחה בטעות בגלל הקירבה אליו במהלך ההתנקשות בו",
    "weapon_raw": "ירי",
    "weapon_type": "Firearm",
    "weapon_detail": "",
    "firearm_involved": "Yes",
    "intent_raw": "",
    "background": "",
    "description": "",
    "notes": "",
    "source_url_1": "",
    "source_url_2": ""
  },
  {
    "record_uid": "2018-34-r37",
    "source_file": "פילוח קרבנות אלימות ופשיעה בחברה הערבית - 2018.csv",
    "source_row_number": 37,
    "dataset_year": 2018,
    "serial_number": "36",
    "record_group": "Main",
    "included_in_main_tally": true,
    "case_number": "34",
    "victim_name_he": "רדאד רדאד",
    "victim_name_ar": "",
    "age": 32,
    "age_group": "30-39",
    "gender_raw": "גבר",
    "gender": "Male",
    "citizen_raw": "",
    "citizen_status": "Unknown",
    "religion": "",
    "residence_locality": "ג'סר אזרקא",
    "residence_locality_type": "",
    "residence_population_type": "",
    "geographic_area": "חוף",
    "geographic_area_alt": "משולש",
    "district_state": "",
    "district_police": "",
    "event_date_raw": "31.8.2018",
    "event_date_iso": "2018-08-31",
    "death_date_raw": "31.8.18",
    "death_date_iso": "2018-08-31",
    "month_raw": "8",
    "month_num": 8,
    "incident_location": "ג'סר אזרקא",
    "exact_location": "",
    "solved_raw": "",
    "solved_status": "Solved/Indicted",
    "police_status": "פוענח בחודש אוקטובר 2018. הוגשו כתבי אישום נגד שני תושבי הכפר בני 23 ו-32 שירו אל הבית בעת שישב עם שלושה מחבריו בחצר בית בכפר. ככל הנראה, הקורבן לא היה קשור לסכסוך שבגללו נורו היריות. שלושת חבריו נפצעו באירוע באורח בינוני וקל.",
    "weapon_raw": "ירי",
    "weapon_type": "Firearm",
    "weapon_detail": "",
    "firearm_involved": "Yes",
    "intent_raw": "",
    "background": "",
    "description": "",
    "notes": "",
    "source_url_1": "",
    "source_url_2": ""
  },
  {
    "record_uid": "2018-35-r38",
    "source_file": "פילוח קרבנות אלימות ופשיעה בחברה הערבית - 2018.csv",
    "source_row_number": 38,
    "dataset_year": 2018,
    "serial_number": "37",
    "record_group": "Main",
    "included_in_main_tally": true,
    "case_number": "35",
    "victim_name_he": "יונתן נויסרי",
    "victim_name_ar": "",
    "age": 24,
    "age_group": "18-24",
    "gender_raw": "גבר",
    "gender": "Male",
    "citizen_raw": "",
    "citizen_status": "Unknown",
    "religion": "",
    "residence_locality": "ריינה",
    "residence_locality_type": "",
    "residence_population_type": "",
    "geographic_area": "צפון",
    "geographic_area_alt": "גליל",
    "district_state": "",
    "district_police": "",
    "event_date_raw": "1.9.2018",
    "event_date_iso": "2018-09-01",
    "death_date_raw": "1.9.18",
    "death_date_iso": "2018-09-01",
    "month_raw": "9",
    "month_num": 9,
    "incident_location": "ריינה",
    "exact_location": "",
    "solved_raw": "",
    "solved_status": "Solved/Indicted",
    "police_status": "כתב אישום הוגש נגד 8 חשודים בחודש אוקטובר. על רקע של ויכוח בין נהגים",
    "weapon_raw": "סכין",
    "weapon_type": "Sharp Object",
    "weapon_detail": "",
    "firearm_involved": "No",
    "intent_raw": "",
    "background": "",
    "description": "",
    "notes": "",
    "source_url_1": "",
    "source_url_2": ""
  },
  {
    "record_uid": "2018-36-r39",
    "source_file": "פילוח קרבנות אלימות ופשיעה בחברה הערבית - 2018.csv",
    "source_row_number": 39,
    "dataset_year": 2018,
    "serial_number": "38",
    "record_group": "Main",
    "included_in_main_tally": true,
    "case_number": "36",
    "victim_name_he": "עזאם רדואן אלסיורי",
    "victim_name_ar": "",
    "age": 66,
    "age_group": "65+",
    "gender_raw": "גבר",
    "gender": "Male",
    "citizen_raw": "",
    "citizen_status": "Unknown",
    "religion": "",
    "residence_locality": "יפו",
    "residence_locality_type": "",
    "residence_population_type": "",
    "geographic_area": "תל אביב-יפו",
    "geographic_area_alt": "ערים מעורבות",
    "district_state": "",
    "district_police": "",
    "event_date_raw": "2.9.2018",
    "event_date_iso": "2018-09-02",
    "death_date_raw": "2.9.18",
    "death_date_iso": "2018-09-02",
    "month_raw": "9",
    "month_num": 9,
    "incident_location": "יפו",
    "exact_location": "",
    "solved_raw": "",
    "solved_status": "Unknown",
    "police_status": "בספטמבר 2018 נעצר קטין החשוד במעורבות בהצתה",
    "weapon_raw": "הצתת מבנה",
    "weapon_type": "Other",
    "weapon_detail": "",
    "firearm_involved": "Unknown",
    "intent_raw": "",
    "background": "",
    "description": "",
    "notes": "",
    "source_url_1": "",
    "source_url_2": ""
  },
  {
    "record_uid": "2018-36-r40",
    "source_file": "פילוח קרבנות אלימות ופשיעה בחברה הערבית - 2018.csv",
    "source_row_number": 40,
    "dataset_year": 2018,
    "serial_number": "39",
    "record_group": "Main",
    "included_in_main_tally": true,
    "case_number": "36",
    "victim_name_he": "תחריר סעד",
    "victim_name_ar": "",
    "age": 28,
    "age_group": "25-29",
    "gender_raw": "אישה",
    "gender": "Female",
    "citizen_raw": "",
    "citizen_status": "Unknown",
    "religion": "",
    "residence_locality": "יפו",
    "residence_locality_type": "",
    "residence_population_type": "",
    "geographic_area": "תל אביב-יפו",
    "geographic_area_alt": "ערים מעורבות",
    "district_state": "",
    "district_police": "",
    "event_date_raw": "2.9.2018",
    "event_date_iso": "2018-09-02",
    "death_date_raw": "2.9.18",
    "death_date_iso": "2018-09-02",
    "month_raw": "9",
    "month_num": 9,
    "incident_location": "יפו",
    "exact_location": "",
    "solved_raw": "",
    "solved_status": "Unknown",
    "police_status": "בספטמבר 2018 נעצר קטין החשוד במעורבות בהצתה",
    "weapon_raw": "הצתת מבנה",
    "weapon_type": "Other",
    "weapon_detail": "",
    "firearm_involved": "Unknown",
    "intent_raw": "",
    "background": "",
    "description": "",
    "notes": "",
    "source_url_1": "",
    "source_url_2": ""
  },
  {
    "record_uid": "2018-37-r41",
    "source_file": "פילוח קרבנות אלימות ופשיעה בחברה הערבית - 2018.csv",
    "source_row_number": 41,
    "dataset_year": 2018,
    "serial_number": "40",
    "record_group": "Main",
    "included_in_main_tally": true,
    "case_number": "37",
    "victim_name_he": "מואמן דעיף",
    "victim_name_ar": "",
    "age": 22,
    "age_group": "18-24",
    "gender_raw": "גבר",
    "gender": "Male",
    "citizen_raw": "",
    "citizen_status": "Unknown",
    "religion": "",
    "residence_locality": "עארה",
    "residence_locality_type": "",
    "residence_population_type": "",
    "geographic_area": "משולש צפוני",
    "geographic_area_alt": "משולש",
    "district_state": "",
    "district_police": "",
    "event_date_raw": "16.9.2018",
    "event_date_iso": "2018-09-16",
    "death_date_raw": "16.9.18",
    "death_date_iso": "2018-09-16",
    "month_raw": "9",
    "month_num": 9,
    "incident_location": "עארה",
    "exact_location": "",
    "solved_raw": "",
    "solved_status": "Unknown",
    "police_status": "",
    "weapon_raw": "ירי",
    "weapon_type": "Firearm",
    "weapon_detail": "",
    "firearm_involved": "Yes",
    "intent_raw": "",
    "background": "",
    "description": "",
    "notes": "",
    "source_url_1": "",
    "source_url_2": ""
  },
  {
    "record_uid": "2018-38-r42",
    "source_file": "פילוח קרבנות אלימות ופשיעה בחברה הערבית - 2018.csv",
    "source_row_number": 42,
    "dataset_year": 2018,
    "serial_number": "41",
    "record_group": "Main",
    "included_in_main_tally": true,
    "case_number": "38",
    "victim_name_he": "מוחמד חמאד מחאמיד",
    "victim_name_ar": "",
    "age": 33,
    "age_group": "30-39",
    "gender_raw": "גבר",
    "gender": "Male",
    "citizen_raw": "",
    "citizen_status": "Unknown",
    "religion": "",
    "residence_locality": "אום אלפחם",
    "residence_locality_type": "",
    "residence_population_type": "",
    "geographic_area": "משולש צפוני",
    "geographic_area_alt": "משולש",
    "district_state": "",
    "district_police": "",
    "event_date_raw": "17.9.2018",
    "event_date_iso": "2018-09-17",
    "death_date_raw": "17.9.18",
    "death_date_iso": "2018-09-17",
    "month_raw": "9",
    "month_num": 9,
    "incident_location": "אום אלפחם",
    "exact_location": "",
    "solved_raw": "",
    "solved_status": "Unknown",
    "police_status": "נדקר במהלך קטטה",
    "weapon_raw": "סכין",
    "weapon_type": "Sharp Object",
    "weapon_detail": "",
    "firearm_involved": "No",
    "intent_raw": "",
    "background": "",
    "description": "",
    "notes": "",
    "source_url_1": "",
    "source_url_2": ""
  },
  {
    "record_uid": "2018-39-r43",
    "source_file": "פילוח קרבנות אלימות ופשיעה בחברה הערבית - 2018.csv",
    "source_row_number": 43,
    "dataset_year": 2018,
    "serial_number": "42",
    "record_group": "Main",
    "included_in_main_tally": true,
    "case_number": "39",
    "victim_name_he": "עפאף אלגרגאוי",
    "victim_name_ar": "",
    "age": 21,
    "age_group": "18-24",
    "gender_raw": "אישה",
    "gender": "Female",
    "citizen_raw": "",
    "citizen_status": "Unknown",
    "religion": "",
    "residence_locality": "שגב שלום",
    "residence_locality_type": "",
    "residence_population_type": "",
    "geographic_area": "דרום",
    "geographic_area_alt": "נגב",
    "district_state": "",
    "district_police": "",
    "event_date_raw": "25.9.2018",
    "event_date_iso": "2018-09-25",
    "death_date_raw": "25.9.18",
    "death_date_iso": "2018-09-25",
    "month_raw": "9",
    "month_num": 9,
    "incident_location": "שגב שלום",
    "exact_location": "",
    "solved_raw": "",
    "solved_status": "Unknown",
    "police_status": "הוטל צו איסור פרסום",
    "weapon_raw": "ירי",
    "weapon_type": "Firearm",
    "weapon_detail": "",
    "firearm_involved": "Yes",
    "intent_raw": "",
    "background": "",
    "description": "",
    "notes": "",
    "source_url_1": "",
    "source_url_2": ""
  },
  {
    "record_uid": "2018-40-r44",
    "source_file": "פילוח קרבנות אלימות ופשיעה בחברה הערבית - 2018.csv",
    "source_row_number": 44,
    "dataset_year": 2018,
    "serial_number": "43",
    "record_group": "Main",
    "included_in_main_tally": true,
    "case_number": "40",
    "victim_name_he": "ראוף כמאל עטור",
    "victim_name_ar": "",
    "age": 24,
    "age_group": "18-24",
    "gender_raw": "גבר",
    "gender": "Male",
    "citizen_raw": "",
    "citizen_status": "Unknown",
    "religion": "",
    "residence_locality": "ראמה",
    "residence_locality_type": "",
    "residence_population_type": "",
    "geographic_area": "צפון",
    "geographic_area_alt": "גליל",
    "district_state": "",
    "district_police": "",
    "event_date_raw": "28.9.2018",
    "event_date_iso": "2018-09-28",
    "death_date_raw": "28.9.18",
    "death_date_iso": "2018-09-28",
    "month_raw": "9",
    "month_num": 9,
    "incident_location": "ראמה",
    "exact_location": "",
    "solved_raw": "",
    "solved_status": "Unknown",
    "police_status": "נורו על-ידי נוסע ברכב חולף",
    "weapon_raw": "ירי",
    "weapon_type": "Firearm",
    "weapon_detail": "",
    "firearm_involved": "Yes",
    "intent_raw": "",
    "background": "",
    "description": "",
    "notes": "",
    "source_url_1": "",
    "source_url_2": ""
  },
  {
    "record_uid": "2018-40-r45",
    "source_file": "פילוח קרבנות אלימות ופשיעה בחברה הערבית - 2018.csv",
    "source_row_number": 45,
    "dataset_year": 2018,
    "serial_number": "44",
    "record_group": "Main",
    "included_in_main_tally": true,
    "case_number": "40",
    "victim_name_he": "קוסאי אמיר עטור",
    "victim_name_ar": "",
    "age": 18,
    "age_group": "18-24",
    "gender_raw": "גבר",
    "gender": "Male",
    "citizen_raw": "",
    "citizen_status": "Unknown",
    "religion": "",
    "residence_locality": "ראמה",
    "residence_locality_type": "",
    "residence_population_type": "",
    "geographic_area": "צפון",
    "geographic_area_alt": "גליל",
    "district_state": "",
    "district_police": "",
    "event_date_raw": "28.9.2018",
    "event_date_iso": "2018-09-28",
    "death_date_raw": "28.9.18",
    "death_date_iso": "2018-09-28",
    "month_raw": "9",
    "month_num": 9,
    "incident_location": "ראמה",
    "exact_location": "",
    "solved_raw": "",
    "solved_status": "Unknown",
    "police_status": "נורו על-ידי נוסע ברכב חולף",
    "weapon_raw": "ירי",
    "weapon_type": "Firearm",
    "weapon_detail": "",
    "firearm_involved": "Yes",
    "intent_raw": "",
    "background": "",
    "description": "",
    "notes": "",
    "source_url_1": "",
    "source_url_2": ""
  },
  {
    "record_uid": "2018-41-r46",
    "source_file": "פילוח קרבנות אלימות ופשיעה בחברה הערבית - 2018.csv",
    "source_row_number": 46,
    "dataset_year": 2018,
    "serial_number": "45",
    "record_group": "Main",
    "included_in_main_tally": true,
    "case_number": "41",
    "victim_name_he": "נאדר שקרה",
    "victim_name_ar": "",
    "age": 30,
    "age_group": "30-39",
    "gender_raw": "גבר",
    "gender": "Male",
    "citizen_raw": "",
    "citizen_status": "Unknown",
    "religion": "",
    "residence_locality": "יפו",
    "residence_locality_type": "",
    "residence_population_type": "",
    "geographic_area": "תל אביב-יפו",
    "geographic_area_alt": "ערים מעורבות",
    "district_state": "",
    "district_police": "",
    "event_date_raw": "9.10.2018",
    "event_date_iso": "2018-10-09",
    "death_date_raw": "9.10.18",
    "death_date_iso": "2018-10-09",
    "month_raw": "10",
    "month_num": 10,
    "incident_location": "יפו",
    "exact_location": "",
    "solved_raw": "",
    "solved_status": "Unknown",
    "police_status": "",
    "weapon_raw": "ירי",
    "weapon_type": "Firearm",
    "weapon_detail": "",
    "firearm_involved": "Yes",
    "intent_raw": "",
    "background": "",
    "description": "",
    "notes": "",
    "source_url_1": "",
    "source_url_2": ""
  },
  {
    "record_uid": "2018-42-r47",
    "source_file": "פילוח קרבנות אלימות ופשיעה בחברה הערבית - 2018.csv",
    "source_row_number": 47,
    "dataset_year": 2018,
    "serial_number": "46",
    "record_group": "Main",
    "included_in_main_tally": true,
    "case_number": "42",
    "victim_name_he": "גמיל עראקי",
    "victim_name_ar": "",
    "age": 60,
    "age_group": "50-64",
    "gender_raw": "גבר",
    "gender": "Male",
    "citizen_raw": "",
    "citizen_status": "Unknown",
    "religion": "",
    "residence_locality": "טירה",
    "residence_locality_type": "",
    "residence_population_type": "",
    "geographic_area": "משולש דרומי",
    "geographic_area_alt": "משולש",
    "district_state": "",
    "district_police": "",
    "event_date_raw": "19.10.2018",
    "event_date_iso": "2018-10-19",
    "death_date_raw": "19.10.18",
    "death_date_iso": "2018-10-19",
    "month_raw": "10",
    "month_num": 10,
    "incident_location": "טירה",
    "exact_location": "",
    "solved_raw": "",
    "solved_status": "Unknown",
    "police_status": "בתחילת נובמבר 2018 נעצר חשוד במעשה",
    "weapon_raw": "ירי",
    "weapon_type": "Firearm",
    "weapon_detail": "",
    "firearm_involved": "Yes",
    "intent_raw": "",
    "background": "",
    "description": "",
    "notes": "",
    "source_url_1": "https://www.ynet.co.il/news/article/5374625",
    "source_url_2": ""
  },
  {
    "record_uid": "2018-43-r48",
    "source_file": "פילוח קרבנות אלימות ופשיעה בחברה הערבית - 2018.csv",
    "source_row_number": 48,
    "dataset_year": 2018,
    "serial_number": "47",
    "record_group": "Main",
    "included_in_main_tally": true,
    "case_number": "43",
    "victim_name_he": "כמאל תפאל",
    "victim_name_ar": "",
    "age": 51,
    "age_group": "50-64",
    "gender_raw": "גבר",
    "gender": "Male",
    "citizen_raw": "",
    "citizen_status": "Unknown",
    "religion": "",
    "residence_locality": "שפרעם",
    "residence_locality_type": "",
    "residence_population_type": "",
    "geographic_area": "צפון",
    "geographic_area_alt": "גליל",
    "district_state": "",
    "district_police": "",
    "event_date_raw": "9.11.2018",
    "event_date_iso": "2018-11-09",
    "death_date_raw": "11.11.18",
    "death_date_iso": "2018-11-11",
    "month_raw": "11",
    "month_num": 11,
    "incident_location": "שפרעם",
    "exact_location": "",
    "solved_raw": "",
    "solved_status": "Solved/Indicted",
    "police_status": "הוגש כתב אישום נגד בנו בחודש דצמבר 2018. ב-19.5.2019, בית משפט המחוזי בחיפה הרשיע את אחמד תפאל, תושב שפרעם, בגין הריגת אביו, לאחר שדרס אותו למוות עקב סכסוך משפחתי. תפאל הורשע במסגרת הסדר טיעון וירצה 16 שנות מאסר.",
    "weapon_raw": "דריסה",
    "weapon_type": "Vehicle",
    "weapon_detail": "",
    "firearm_involved": "No",
    "intent_raw": "",
    "background": "",
    "description": "",
    "notes": "",
    "source_url_1": "",
    "source_url_2": ""
  },
  {
    "record_uid": "2018-44-r49",
    "source_file": "פילוח קרבנות אלימות ופשיעה בחברה הערבית - 2018.csv",
    "source_row_number": 49,
    "dataset_year": 2018,
    "serial_number": "48",
    "record_group": "Main",
    "included_in_main_tally": true,
    "case_number": "44",
    "victim_name_he": "סעד ג'בלי",
    "victim_name_ar": "",
    "age": 24,
    "age_group": "18-24",
    "gender_raw": "גבר",
    "gender": "Male",
    "citizen_raw": "",
    "citizen_status": "Unknown",
    "religion": "",
    "residence_locality": "טייבה",
    "residence_locality_type": "",
    "residence_population_type": "",
    "geographic_area": "משולש דרומי",
    "geographic_area_alt": "משולש",
    "district_state": "",
    "district_police": "",
    "event_date_raw": "13.11.2018",
    "event_date_iso": "2018-11-13",
    "death_date_raw": "13.11.18",
    "death_date_iso": "2018-11-13",
    "month_raw": "11",
    "month_num": 11,
    "incident_location": "טייבה",
    "exact_location": "",
    "solved_raw": "",
    "solved_status": "Unknown",
    "police_status": "חוקרי המשטרה עצרו את סארי אבו ערביאן (19) ביום 10.3.2019 ולמחרת את החשוד השני, קטין בן 18, והצליחו לקשור אותם לכאורה למעשה הרצח. כתבי אישום אמורים להיות מוגשים באפריל 2019.",
    "weapon_raw": "ירי",
    "weapon_type": "Firearm",
    "weapon_detail": "",
    "firearm_involved": "Yes",
    "intent_raw": "",
    "background": "",
    "description": "",
    "notes": "",
    "source_url_1": "https://www.ynet.co.il/articles/0,7340,L-5487240,00.html",
    "source_url_2": ""
  },
  {
    "record_uid": "2018-45-r50",
    "source_file": "פילוח קרבנות אלימות ופשיעה בחברה הערבית - 2018.csv",
    "source_row_number": 50,
    "dataset_year": 2018,
    "serial_number": "49",
    "record_group": "Main",
    "included_in_main_tally": true,
    "case_number": "45",
    "victim_name_he": "חליל אבו גאנם",
    "victim_name_ar": "",
    "age": 32,
    "age_group": "30-39",
    "gender_raw": "גבר",
    "gender": "Male",
    "citizen_raw": "",
    "citizen_status": "Unknown",
    "religion": "",
    "residence_locality": "לוד",
    "residence_locality_type": "",
    "residence_population_type": "",
    "geographic_area": "מרכז",
    "geographic_area_alt": "ערים מעורבות",
    "district_state": "",
    "district_police": "",
    "event_date_raw": "19.11.2018",
    "event_date_iso": "2018-11-19",
    "death_date_raw": "19.11.18",
    "death_date_iso": "2018-11-19",
    "month_raw": "11",
    "month_num": 11,
    "incident_location": "חולון",
    "exact_location": "",
    "solved_raw": "",
    "solved_status": "Unknown",
    "police_status": "רקע של סכסוך משפחות",
    "weapon_raw": "ירי",
    "weapon_type": "Firearm",
    "weapon_detail": "",
    "firearm_involved": "Yes",
    "intent_raw": "",
    "background": "",
    "description": "",
    "notes": "",
    "source_url_1": "",
    "source_url_2": ""
  },
  {
    "record_uid": "2018-46-r51",
    "source_file": "פילוח קרבנות אלימות ופשיעה בחברה הערבית - 2018.csv",
    "source_row_number": 51,
    "dataset_year": 2018,
    "serial_number": "50",
    "record_group": "Main",
    "included_in_main_tally": true,
    "case_number": "46",
    "victim_name_he": "מנאל פריזאת",
    "victim_name_ar": "",
    "age": 41,
    "age_group": "40-49",
    "gender_raw": "אישה",
    "gender": "Female",
    "citizen_raw": "",
    "citizen_status": "Unknown",
    "religion": "",
    "residence_locality": "תל שבע",
    "residence_locality_type": "",
    "residence_population_type": "",
    "geographic_area": "דרום",
    "geographic_area_alt": "נגב",
    "district_state": "",
    "district_police": "",
    "event_date_raw": "21.11.2018",
    "event_date_iso": "2018-11-21",
    "death_date_raw": "21.11.18",
    "death_date_iso": "2018-11-21",
    "month_raw": "11",
    "month_num": 11,
    "incident_location": "תל שבע",
    "exact_location": "",
    "solved_raw": "",
    "solved_status": "Unknown",
    "police_status": "אחיה נעצר בחשד לרצח",
    "weapon_raw": "ירי",
    "weapon_type": "Firearm",
    "weapon_detail": "",
    "firearm_involved": "Yes",
    "intent_raw": "",
    "background": "",
    "description": "",
    "notes": "",
    "source_url_1": "",
    "source_url_2": ""
  },
  {
    "record_uid": "2018-47-r52",
    "source_file": "פילוח קרבנות אלימות ופשיעה בחברה הערבית - 2018.csv",
    "source_row_number": 52,
    "dataset_year": 2018,
    "serial_number": "51",
    "record_group": "Main",
    "included_in_main_tally": true,
    "case_number": "47",
    "victim_name_he": "זייד אחמד עאסלה",
    "victim_name_ar": "",
    "age": 38,
    "age_group": "30-39",
    "gender_raw": "גבר",
    "gender": "Male",
    "citizen_raw": "",
    "citizen_status": "Unknown",
    "religion": "",
    "residence_locality": "עראבה",
    "residence_locality_type": "",
    "residence_population_type": "",
    "geographic_area": "צפון",
    "geographic_area_alt": "גליל",
    "district_state": "",
    "district_police": "",
    "event_date_raw": "23.11.2018",
    "event_date_iso": "2018-11-23",
    "death_date_raw": "23.11.18",
    "death_date_iso": "2018-11-23",
    "month_raw": "11",
    "month_num": 11,
    "incident_location": "עראבה",
    "exact_location": "",
    "solved_raw": "",
    "solved_status": "Solved/Indicted",
    "police_status": "בתוך תחנת דלק. הוגש כתב אישום בחודש דצמבר נגד מאמון בן אמין בדארנה, בן 35 תושב עראבה",
    "weapon_raw": "סכין",
    "weapon_type": "Sharp Object",
    "weapon_detail": "",
    "firearm_involved": "No",
    "intent_raw": "",
    "background": "",
    "description": "",
    "notes": "",
    "source_url_1": "",
    "source_url_2": ""
  },
  {
    "record_uid": "2018-48-r53",
    "source_file": "פילוח קרבנות אלימות ופשיעה בחברה הערבית - 2018.csv",
    "source_row_number": 53,
    "dataset_year": 2018,
    "serial_number": "52",
    "record_group": "Main",
    "included_in_main_tally": true,
    "case_number": "48",
    "victim_name_he": "עבד זאיד אבו עלו",
    "victim_name_ar": "",
    "age": 17,
    "age_group": "0-17",
    "gender_raw": "גבר",
    "gender": "Male",
    "citizen_raw": "",
    "citizen_status": "Unknown",
    "religion": "",
    "residence_locality": "אום אלפחם",
    "residence_locality_type": "",
    "residence_population_type": "",
    "geographic_area": "משולש צפוני",
    "geographic_area_alt": "משולש",
    "district_state": "",
    "district_police": "",
    "event_date_raw": "24.11.2018",
    "event_date_iso": "2018-11-24",
    "death_date_raw": "24.11.18",
    "death_date_iso": "2018-11-24",
    "month_raw": "11",
    "month_num": 11,
    "incident_location": "אום אלפחם",
    "exact_location": "",
    "solved_raw": "",
    "solved_status": "Unknown",
    "police_status": "ירה כדור בראשו כשבדק נשק",
    "weapon_raw": "ירי",
    "weapon_type": "Firearm",
    "weapon_detail": "",
    "firearm_involved": "Yes",
    "intent_raw": "",
    "background": "",
    "description": "",
    "notes": "",
    "source_url_1": "",
    "source_url_2": ""
  },
  {
    "record_uid": "2018-49-r54",
    "source_file": "פילוח קרבנות אלימות ופשיעה בחברה הערבית - 2018.csv",
    "source_row_number": 54,
    "dataset_year": 2018,
    "serial_number": "53",
    "record_group": "Main",
    "included_in_main_tally": true,
    "case_number": "49",
    "victim_name_he": "יארא איוב",
    "victim_name_ar": "",
    "age": 16,
    "age_group": "0-17",
    "gender_raw": "אישה",
    "gender": "Female",
    "citizen_raw": "",
    "citizen_status": "Unknown",
    "religion": "",
    "residence_locality": "ג'יש",
    "residence_locality_type": "",
    "residence_population_type": "",
    "geographic_area": "צפון",
    "geographic_area_alt": "גליל",
    "district_state": "",
    "district_police": "",
    "event_date_raw": "26.11.2018",
    "event_date_iso": "2018-11-26",
    "death_date_raw": "26.11.18",
    "death_date_iso": "2018-11-26",
    "month_raw": "11",
    "month_num": 11,
    "incident_location": "ג'יש",
    "exact_location": "",
    "solved_raw": "",
    "solved_status": "Solved/Indicted",
    "police_status": "נעצרו חשודים והוגש כתב אישום. ב-10.1.2019, הפרקליטות הגישה כתבי אישום נגד תושבי גוש חלב, מוחמד אבו זיינב בן 29 ונער בן 17, בפרשת רצח יארה איוב בת ה-16 בחודש נובמבר האחרון. מכתבי האישום עולה כי במשך חודשים נתן אבו זיינב לנערה \"בלית ברירה\" כסף בסכומים של מאות שקלים, וביום הרצח \"מאס בכך\". עוד תואר כי \"הנאשמים רצחו את הקטינה במאפייה שמנוהלת על ידי אבו זיינב, תוך שהם משספים את גרונה וגורמים לפצעי דקירה וחתכים נוספים בגופה\".",
    "weapon_raw": "סכין",
    "weapon_type": "Sharp Object",
    "weapon_detail": "",
    "firearm_involved": "No",
    "intent_raw": "",
    "background": "",
    "description": "",
    "notes": "",
    "source_url_1": "",
    "source_url_2": ""
  },
  {
    "record_uid": "2018-50-r55",
    "source_file": "פילוח קרבנות אלימות ופשיעה בחברה הערבית - 2018.csv",
    "source_row_number": 55,
    "dataset_year": 2018,
    "serial_number": "54",
    "record_group": "Main",
    "included_in_main_tally": true,
    "case_number": "50",
    "victim_name_he": "חאפז חוסין עיסא",
    "victim_name_ar": "",
    "age": 38,
    "age_group": "30-39",
    "gender_raw": "גבר",
    "gender": "Male",
    "citizen_raw": "",
    "citizen_status": "Unknown",
    "religion": "",
    "residence_locality": "נחף",
    "residence_locality_type": "",
    "residence_population_type": "",
    "geographic_area": "צפון",
    "geographic_area_alt": "גליל",
    "district_state": "",
    "district_police": "",
    "event_date_raw": "27.11.2018",
    "event_date_iso": "2018-11-27",
    "death_date_raw": "27.11.18",
    "death_date_iso": "2018-11-27",
    "month_raw": "11",
    "month_num": 11,
    "incident_location": "נחף",
    "exact_location": "",
    "solved_raw": "",
    "solved_status": "Unknown",
    "police_status": "קטטה. נעצרו 2 חשודים מיד כשהמשטרה הגיעה למקום בחשד למעורבות בקטטה",
    "weapon_raw": "סכין",
    "weapon_type": "Sharp Object",
    "weapon_detail": "",
    "firearm_involved": "No",
    "intent_raw": "",
    "background": "",
    "description": "",
    "notes": "",
    "source_url_1": "",
    "source_url_2": ""
  },
  {
    "record_uid": "2018-51-r56",
    "source_file": "פילוח קרבנות אלימות ופשיעה בחברה הערבית - 2018.csv",
    "source_row_number": 56,
    "dataset_year": 2018,
    "serial_number": "55",
    "record_group": "Main",
    "included_in_main_tally": true,
    "case_number": "51",
    "victim_name_he": "פהד אלקסאסי",
    "victim_name_ar": "",
    "age": 22,
    "age_group": "18-24",
    "gender_raw": "גבר",
    "gender": "Male",
    "citizen_raw": "",
    "citizen_status": "Unknown",
    "religion": "",
    "residence_locality": "רהט",
    "residence_locality_type": "",
    "residence_population_type": "",
    "geographic_area": "דרום",
    "geographic_area_alt": "נגב",
    "district_state": "",
    "district_police": "",
    "event_date_raw": "29.11.2018",
    "event_date_iso": "2018-11-29",
    "death_date_raw": "29.11.18",
    "death_date_iso": "2018-11-29",
    "month_raw": "11",
    "month_num": 11,
    "incident_location": "רהט",
    "exact_location": "",
    "solved_raw": "",
    "solved_status": "Unknown",
    "police_status": "סכסוך שהתגלע בין משפחות בעקבות הבחירות",
    "weapon_raw": "סכין",
    "weapon_type": "Sharp Object",
    "weapon_detail": "",
    "firearm_involved": "No",
    "intent_raw": "",
    "background": "",
    "description": "",
    "notes": "",
    "source_url_1": "",
    "source_url_2": ""
  },
  {
    "record_uid": "2018-52-r57",
    "source_file": "פילוח קרבנות אלימות ופשיעה בחברה הערבית - 2018.csv",
    "source_row_number": 57,
    "dataset_year": 2018,
    "serial_number": "56",
    "record_group": "Main",
    "included_in_main_tally": true,
    "case_number": "52",
    "victim_name_he": "אחמד סלאמה חמדאן",
    "victim_name_ar": "",
    "age": 60,
    "age_group": "50-64",
    "gender_raw": "גבר",
    "gender": "Male",
    "citizen_raw": "",
    "citizen_status": "Unknown",
    "religion": "",
    "residence_locality": "ג'לג'וליה",
    "residence_locality_type": "",
    "residence_population_type": "",
    "geographic_area": "משולש דרומי",
    "geographic_area_alt": "משולש",
    "district_state": "",
    "district_police": "",
    "event_date_raw": "7.12.2018",
    "event_date_iso": "2018-12-07",
    "death_date_raw": "7.12.18",
    "death_date_iso": "2018-12-07",
    "month_raw": "12",
    "month_num": 12,
    "incident_location": "גלגוליה",
    "exact_location": "",
    "solved_raw": "",
    "solved_status": "Unknown",
    "police_status": "חיסול חשבונות, כנראה על הרקע של מכירת אדמות ליהודים על-ידי הנרצח. תחת איסור פרסום",
    "weapon_raw": "ירי",
    "weapon_type": "Firearm",
    "weapon_detail": "",
    "firearm_involved": "Yes",
    "intent_raw": "",
    "background": "",
    "description": "",
    "notes": "",
    "source_url_1": "",
    "source_url_2": ""
  },
  {
    "record_uid": "2018-53-r58",
    "source_file": "פילוח קרבנות אלימות ופשיעה בחברה הערבית - 2018.csv",
    "source_row_number": 58,
    "dataset_year": 2018,
    "serial_number": "57",
    "record_group": "Main",
    "included_in_main_tally": true,
    "case_number": "53",
    "victim_name_he": "אימאן אחמד עווד",
    "victim_name_ar": "",
    "age": 28,
    "age_group": "25-29",
    "gender_raw": "אישה",
    "gender": "Female",
    "citizen_raw": "",
    "citizen_status": "Unknown",
    "religion": "",
    "residence_locality": "עכו",
    "residence_locality_type": "",
    "residence_population_type": "",
    "geographic_area": "חוף",
    "geographic_area_alt": "ערים מעורבות",
    "district_state": "",
    "district_police": "",
    "event_date_raw": "11.12.2018",
    "event_date_iso": "2018-12-11",
    "death_date_raw": "11.12.18",
    "death_date_iso": "2018-12-11",
    "month_raw": "12",
    "month_num": 12,
    "incident_location": "עכו",
    "exact_location": "",
    "solved_raw": "",
    "solved_status": "Unknown",
    "police_status": "בעלה נעצר בחשד לרצח ומאוחר יותר הודה במעשה",
    "weapon_raw": "סכין",
    "weapon_type": "Sharp Object",
    "weapon_detail": "",
    "firearm_involved": "No",
    "intent_raw": "",
    "background": "",
    "description": "",
    "notes": "",
    "source_url_1": "https://www.ynet.co.il/news/article/s1mheycty",
    "source_url_2": ""
  },
  {
    "record_uid": "2018-54-r59",
    "source_file": "פילוח קרבנות אלימות ופשיעה בחברה הערבית - 2018.csv",
    "source_row_number": 59,
    "dataset_year": 2018,
    "serial_number": "58",
    "record_group": "Main",
    "included_in_main_tally": true,
    "case_number": "54",
    "victim_name_he": "ראמי אבו גאבר",
    "victim_name_ar": "",
    "age": 32,
    "age_group": "30-39",
    "gender_raw": "גבר",
    "gender": "Male",
    "citizen_raw": "",
    "citizen_status": "Unknown",
    "religion": "",
    "residence_locality": "כפר קאסם",
    "residence_locality_type": "",
    "residence_population_type": "",
    "geographic_area": "משולש דרומי",
    "geographic_area_alt": "משולש",
    "district_state": "",
    "district_police": "",
    "event_date_raw": "12.12.2018",
    "event_date_iso": "2018-12-12",
    "death_date_raw": "12.12.18",
    "death_date_iso": "2018-12-12",
    "month_raw": "12",
    "month_num": 12,
    "incident_location": "כביש 5 סמוך לצומת קסם",
    "exact_location": "",
    "solved_raw": "",
    "solved_status": "Unknown",
    "police_status": "חיסול באמצעות פצצה שהוצמדה לרכב",
    "weapon_raw": "מטען חבלה",
    "weapon_type": "Explosive",
    "weapon_detail": "",
    "firearm_involved": "Unknown",
    "intent_raw": "",
    "background": "",
    "description": "",
    "notes": "",
    "source_url_1": "",
    "source_url_2": ""
  },
  {
    "record_uid": "2018-55-r60",
    "source_file": "פילוח קרבנות אלימות ופשיעה בחברה הערבית - 2018.csv",
    "source_row_number": 60,
    "dataset_year": 2018,
    "serial_number": "59",
    "record_group": "Main",
    "included_in_main_tally": true,
    "case_number": "55",
    "victim_name_he": "אשרף אבו קאעוד",
    "victim_name_ar": "",
    "age": 43,
    "age_group": "40-49",
    "gender_raw": "גבר",
    "gender": "Male",
    "citizen_raw": "",
    "citizen_status": "Unknown",
    "religion": "",
    "residence_locality": "יפו",
    "residence_locality_type": "",
    "residence_population_type": "",
    "geographic_area": "תל אביב-יפו",
    "geographic_area_alt": "ערים מעורבות",
    "district_state": "",
    "district_police": "",
    "event_date_raw": "14.12.2018",
    "event_date_iso": "2018-12-14",
    "death_date_raw": "15.12.18",
    "death_date_iso": "2018-12-15",
    "month_raw": "12",
    "month_num": 12,
    "incident_location": "יפו",
    "exact_location": "",
    "solved_raw": "",
    "solved_status": "Solved/Indicted",
    "police_status": "פוענח בחודש מרץ 2019. רצח עקב סכסוך על דירת מגורים. נעצרו אחמד וג'מיל עדס, תושבי העיר בני 24 ו-22 שחשודים בביצוע הרצח",
    "weapon_raw": "ירי",
    "weapon_type": "Firearm",
    "weapon_detail": "",
    "firearm_involved": "Yes",
    "intent_raw": "",
    "background": "",
    "description": "",
    "notes": "",
    "source_url_1": "https://www.ynet.co.il/articles/0,7340,L-5473115,00.html",
    "source_url_2": ""
  },
  {
    "record_uid": "2018-56-r61",
    "source_file": "פילוח קרבנות אלימות ופשיעה בחברה הערבית - 2018.csv",
    "source_row_number": 61,
    "dataset_year": 2018,
    "serial_number": "60",
    "record_group": "Main",
    "included_in_main_tally": true,
    "case_number": "56",
    "victim_name_he": "מוחמד דיאק",
    "victim_name_ar": "",
    "age": 22,
    "age_group": "18-24",
    "gender_raw": "גבר",
    "gender": "Male",
    "citizen_raw": "",
    "citizen_status": "Unknown",
    "religion": "",
    "residence_locality": "יפיע",
    "residence_locality_type": "",
    "residence_population_type": "",
    "geographic_area": "צפון",
    "geographic_area_alt": "גליל",
    "district_state": "",
    "district_police": "",
    "event_date_raw": "15.12.2018",
    "event_date_iso": "2018-12-15",
    "death_date_raw": "15.12.18",
    "death_date_iso": "2018-12-15",
    "month_raw": "12",
    "month_num": 12,
    "incident_location": "יפיע",
    "exact_location": "",
    "solved_raw": "",
    "solved_status": "Unknown",
    "police_status": "",
    "weapon_raw": "ירי",
    "weapon_type": "Firearm",
    "weapon_detail": "",
    "firearm_involved": "Yes",
    "intent_raw": "",
    "background": "",
    "description": "",
    "notes": "",
    "source_url_1": "",
    "source_url_2": ""
  },
  {
    "record_uid": "2018-57-r62",
    "source_file": "פילוח קרבנות אלימות ופשיעה בחברה הערבית - 2018.csv",
    "source_row_number": 62,
    "dataset_year": 2018,
    "serial_number": "61",
    "record_group": "Main",
    "included_in_main_tally": true,
    "case_number": "57",
    "victim_name_he": "עלי אלאעסם",
    "victim_name_ar": "",
    "age": 26,
    "age_group": "25-29",
    "gender_raw": "גבר",
    "gender": "Male",
    "citizen_raw": "",
    "citizen_status": "Unknown",
    "religion": "",
    "residence_locality": "לוד",
    "residence_locality_type": "",
    "residence_population_type": "",
    "geographic_area": "מרכז",
    "geographic_area_alt": "ערים מעורבות",
    "district_state": "",
    "district_police": "",
    "event_date_raw": "15.12.2018",
    "event_date_iso": "2018-12-15",
    "death_date_raw": "15.12.18",
    "death_date_iso": "2018-12-15",
    "month_raw": "12",
    "month_num": 12,
    "incident_location": "רמלה",
    "exact_location": "",
    "solved_raw": "",
    "solved_status": "Unknown",
    "police_status": "מבוי סתום בחקירה. כנראה טעות בזיהוי",
    "weapon_raw": "ירי",
    "weapon_type": "Firearm",
    "weapon_detail": "",
    "firearm_involved": "Yes",
    "intent_raw": "",
    "background": "",
    "description": "",
    "notes": "",
    "source_url_1": "",
    "source_url_2": ""
  },
  {
    "record_uid": "2018-58-r63",
    "source_file": "פילוח קרבנות אלימות ופשיעה בחברה הערבית - 2018.csv",
    "source_row_number": 63,
    "dataset_year": 2018,
    "serial_number": "62",
    "record_group": "Main",
    "included_in_main_tally": true,
    "case_number": "58",
    "victim_name_he": "גדוע אלזבארקה",
    "victim_name_ar": "",
    "age": 38,
    "age_group": "30-39",
    "gender_raw": "גבר",
    "gender": "Male",
    "citizen_raw": "",
    "citizen_status": "Unknown",
    "religion": "",
    "residence_locality": "לוד",
    "residence_locality_type": "",
    "residence_population_type": "",
    "geographic_area": "מרכז",
    "geographic_area_alt": "ערים מעורבות",
    "district_state": "",
    "district_police": "",
    "event_date_raw": "15.12.2018",
    "event_date_iso": "2018-12-15",
    "death_date_raw": "15.12.18",
    "death_date_iso": "2018-12-15",
    "month_raw": "12",
    "month_num": 12,
    "incident_location": "לוד",
    "exact_location": "",
    "solved_raw": "",
    "solved_status": "Unknown",
    "police_status": "רצח כפול. ב-27.4.2019 נעצר מוחמד אבו סעלוק בחשד למעורבות ברצח",
    "weapon_raw": "ירי",
    "weapon_type": "Firearm",
    "weapon_detail": "",
    "firearm_involved": "Yes",
    "intent_raw": "",
    "background": "",
    "description": "",
    "notes": "",
    "source_url_1": "",
    "source_url_2": ""
  },
  {
    "record_uid": "2018-58-r64",
    "source_file": "פילוח קרבנות אלימות ופשיעה בחברה הערבית - 2018.csv",
    "source_row_number": 64,
    "dataset_year": 2018,
    "serial_number": "63",
    "record_group": "Main",
    "included_in_main_tally": true,
    "case_number": "58",
    "victim_name_he": "אמנה אזבארגה",
    "victim_name_ar": "",
    "age": 37,
    "age_group": "30-39",
    "gender_raw": "אישה",
    "gender": "Female",
    "citizen_raw": "",
    "citizen_status": "Unknown",
    "religion": "",
    "residence_locality": "לוד",
    "residence_locality_type": "",
    "residence_population_type": "",
    "geographic_area": "מרכז",
    "geographic_area_alt": "ערים מעורבות",
    "district_state": "",
    "district_police": "",
    "event_date_raw": "15.12.2018",
    "event_date_iso": "2018-12-15",
    "death_date_raw": "15.12.18",
    "death_date_iso": "2018-12-15",
    "month_raw": "12",
    "month_num": 12,
    "incident_location": "לוד",
    "exact_location": "",
    "solved_raw": "",
    "solved_status": "Unknown",
    "police_status": "רצח כפול. ב-27.4.2019 נעצר מוחמד אבו סעלוק בחשד למעורבות ברצח",
    "weapon_raw": "ירי",
    "weapon_type": "Firearm",
    "weapon_detail": "",
    "firearm_involved": "Yes",
    "intent_raw": "",
    "background": "",
    "description": "",
    "notes": "",
    "source_url_1": "",
    "source_url_2": ""
  },
  {
    "record_uid": "2018-59-r65",
    "source_file": "פילוח קרבנות אלימות ופשיעה בחברה הערבית - 2018.csv",
    "source_row_number": 65,
    "dataset_year": 2018,
    "serial_number": "64",
    "record_group": "Main",
    "included_in_main_tally": true,
    "case_number": "59",
    "victim_name_he": "חודיפה אלחרירי",
    "victim_name_ar": "",
    "age": 21,
    "age_group": "18-24",
    "gender_raw": "גבר",
    "gender": "Male",
    "citizen_raw": "",
    "citizen_status": "Unknown",
    "religion": "",
    "residence_locality": "ג'לג'וליה",
    "residence_locality_type": "",
    "residence_population_type": "",
    "geographic_area": "משולש דרומי",
    "geographic_area_alt": "משולש",
    "district_state": "",
    "district_police": "",
    "event_date_raw": "18.12.2018",
    "event_date_iso": "2018-12-18",
    "death_date_raw": "19.12.18",
    "death_date_iso": "2018-12-19",
    "month_raw": "12",
    "month_num": 12,
    "incident_location": "צומת מגידו",
    "exact_location": "",
    "solved_raw": "",
    "solved_status": "Unknown",
    "police_status": "רצח כפול רב נפגעים. על רקע של סכסוך בין עבריינים",
    "weapon_raw": "ירי",
    "weapon_type": "Firearm",
    "weapon_detail": "",
    "firearm_involved": "Yes",
    "intent_raw": "",
    "background": "",
    "description": "",
    "notes": "",
    "source_url_1": "",
    "source_url_2": ""
  },
  {
    "record_uid": "2018-59-r66",
    "source_file": "פילוח קרבנות אלימות ופשיעה בחברה הערבית - 2018.csv",
    "source_row_number": 66,
    "dataset_year": 2018,
    "serial_number": "65",
    "record_group": "Main",
    "included_in_main_tally": true,
    "case_number": "59",
    "victim_name_he": "קעקאע אלחרירי",
    "victim_name_ar": "",
    "age": 31,
    "age_group": "30-39",
    "gender_raw": "גבר",
    "gender": "Male",
    "citizen_raw": "",
    "citizen_status": "Unknown",
    "religion": "",
    "residence_locality": "ג'לג'וליה",
    "residence_locality_type": "",
    "residence_population_type": "",
    "geographic_area": "משולש דרומי",
    "geographic_area_alt": "משולש",
    "district_state": "",
    "district_police": "",
    "event_date_raw": "18.12.2018",
    "event_date_iso": "2018-12-18",
    "death_date_raw": "20.12.18",
    "death_date_iso": "2018-12-20",
    "month_raw": "12",
    "month_num": 12,
    "incident_location": "צומת מגידו",
    "exact_location": "",
    "solved_raw": "",
    "solved_status": "Unknown",
    "police_status": "רצח כפול רב נפגעים. על רקע של סכסוך בין עבריינים",
    "weapon_raw": "ירי",
    "weapon_type": "Firearm",
    "weapon_detail": "",
    "firearm_involved": "Yes",
    "intent_raw": "",
    "background": "",
    "description": "",
    "notes": "",
    "source_url_1": "",
    "source_url_2": ""
  },
  {
    "record_uid": "2018-60-r67",
    "source_file": "פילוח קרבנות אלימות ופשיעה בחברה הערבית - 2018.csv",
    "source_row_number": 67,
    "dataset_year": 2018,
    "serial_number": "66",
    "record_group": "Main",
    "included_in_main_tally": true,
    "case_number": "60",
    "victim_name_he": "עבדו שמשום",
    "victim_name_ar": "",
    "age": 25,
    "age_group": "25-29",
    "gender_raw": "גבר",
    "gender": "Male",
    "citizen_raw": "",
    "citizen_status": "Unknown",
    "religion": "",
    "residence_locality": "רמלה",
    "residence_locality_type": "",
    "residence_population_type": "",
    "geographic_area": "מרכז",
    "geographic_area_alt": "ערים מעורבות",
    "district_state": "",
    "district_police": "",
    "event_date_raw": "21.12.2018",
    "event_date_iso": "2018-12-21",
    "death_date_raw": "22.12.18",
    "death_date_iso": "2018-12-22",
    "month_raw": "12",
    "month_num": 12,
    "incident_location": "רמלה",
    "exact_location": "",
    "solved_raw": "",
    "solved_status": "Unknown",
    "police_status": "במכולת שבה עבד שמשום, כנראה על רקע של סכסוך",
    "weapon_raw": "ירי",
    "weapon_type": "Firearm",
    "weapon_detail": "",
    "firearm_involved": "Yes",
    "intent_raw": "",
    "background": "",
    "description": "",
    "notes": "",
    "source_url_1": "",
    "source_url_2": ""
  },
  {
    "record_uid": "2018-61-r68",
    "source_file": "פילוח קרבנות אלימות ופשיעה בחברה הערבית - 2018.csv",
    "source_row_number": 68,
    "dataset_year": 2018,
    "serial_number": "67",
    "record_group": "Main",
    "included_in_main_tally": true,
    "case_number": "61",
    "victim_name_he": "כרים אלגעאר",
    "victim_name_ar": "",
    "age": 16,
    "age_group": "0-17",
    "gender_raw": "גבר",
    "gender": "Male",
    "citizen_raw": "",
    "citizen_status": "Unknown",
    "religion": "",
    "residence_locality": "רהט",
    "residence_locality_type": "",
    "residence_population_type": "",
    "geographic_area": "דרום",
    "geographic_area_alt": "נגב",
    "district_state": "",
    "district_police": "",
    "event_date_raw": "23.12.2018",
    "event_date_iso": "2018-12-23",
    "death_date_raw": "25.12.18",
    "death_date_iso": "2018-12-25",
    "month_raw": "12",
    "month_num": 12,
    "incident_location": "רהט",
    "exact_location": "",
    "solved_raw": "",
    "solved_status": "Unknown",
    "police_status": "",
    "weapon_raw": "ירי",
    "weapon_type": "Firearm",
    "weapon_detail": "",
    "firearm_involved": "Yes",
    "intent_raw": "",
    "background": "",
    "description": "",
    "notes": "",
    "source_url_1": "",
    "source_url_2": ""
  },
  {
    "record_uid": "2018-62-r69",
    "source_file": "פילוח קרבנות אלימות ופשיעה בחברה הערבית - 2018.csv",
    "source_row_number": 69,
    "dataset_year": 2018,
    "serial_number": "68",
    "record_group": "Main",
    "included_in_main_tally": true,
    "case_number": "62",
    "victim_name_he": "סלים שייח גאבר גבארין",
    "victim_name_ar": "",
    "age": 55,
    "age_group": "50-64",
    "gender_raw": "גבר",
    "gender": "Male",
    "citizen_raw": "",
    "citizen_status": "Unknown",
    "religion": "",
    "residence_locality": "אום אלפחם",
    "residence_locality_type": "",
    "residence_population_type": "",
    "geographic_area": "משולש צפוני",
    "geographic_area_alt": "משולש",
    "district_state": "",
    "district_police": "",
    "event_date_raw": "25.12.2018",
    "event_date_iso": "2018-12-25",
    "death_date_raw": "25.12.18",
    "death_date_iso": "2018-12-25",
    "month_raw": "12",
    "month_num": 12,
    "incident_location": "צומת מי עמי אום אלפחם",
    "exact_location": "",
    "solved_raw": "",
    "solved_status": "Solved/Indicted",
    "police_status": "ההרוג הוא אביו של אדם שנחשד ברצח כפול (מקלד) שהתרחש לפני כחצי שנה וטרם פוענח. נקמת דם שבוצעה על-ידי שלושה חשודים: אחמד ג׳בארין, עזיז ג׳בארין ואמיר ג׳בארין. בפברואר 2019 הוגש כתב אישום",
    "weapon_raw": "ירי",
    "weapon_type": "Firearm",
    "weapon_detail": "",
    "firearm_involved": "Yes",
    "intent_raw": "",
    "background": "",
    "description": "",
    "notes": "",
    "source_url_1": "",
    "source_url_2": ""
  },
  {
    "record_uid": "2018-63-r70",
    "source_file": "פילוח קרבנות אלימות ופשיעה בחברה הערבית - 2018.csv",
    "source_row_number": 70,
    "dataset_year": 2018,
    "serial_number": "69",
    "record_group": "Main",
    "included_in_main_tally": true,
    "case_number": "63",
    "victim_name_he": "שאדייה מוסראטי",
    "victim_name_ar": "",
    "age": 29,
    "age_group": "25-29",
    "gender_raw": "אישה",
    "gender": "Female",
    "citizen_raw": "",
    "citizen_status": "Unknown",
    "religion": "",
    "residence_locality": "רמלה",
    "residence_locality_type": "",
    "residence_population_type": "",
    "geographic_area": "מרכז",
    "geographic_area_alt": "ערים מעורבות",
    "district_state": "",
    "district_police": "",
    "event_date_raw": "27.12.2018",
    "event_date_iso": "2018-12-27",
    "death_date_raw": "27.12.18",
    "death_date_iso": "2018-12-27",
    "month_raw": "12",
    "month_num": 12,
    "incident_location": "רמלה",
    "exact_location": "",
    "solved_raw": "",
    "solved_status": "Unknown",
    "police_status": "נעצרו שני קרובי משפחה ושוחררו כעבור כמה ימים",
    "weapon_raw": "ירי",
    "weapon_type": "Firearm",
    "weapon_detail": "",
    "firearm_involved": "Yes",
    "intent_raw": "",
    "background": "",
    "description": "",
    "notes": "",
    "source_url_1": "https://www.ynet.co.il/articles/0,7340,L-5434884,00.html",
    "source_url_2": ""
  },
  {
    "record_uid": "2018-64-r71",
    "source_file": "פילוח קרבנות אלימות ופשיעה בחברה הערבית - 2018.csv",
    "source_row_number": 71,
    "dataset_year": 2018,
    "serial_number": "70",
    "record_group": "Main",
    "included_in_main_tally": true,
    "case_number": "64",
    "victim_name_he": "מוחיי נסראללה",
    "victim_name_ar": "",
    "age": 43,
    "age_group": "40-49",
    "gender_raw": "גבר",
    "gender": "Male",
    "citizen_raw": "",
    "citizen_status": "Unknown",
    "religion": "",
    "residence_locality": "קלנסווה",
    "residence_locality_type": "",
    "residence_population_type": "",
    "geographic_area": "משולש דרומי",
    "geographic_area_alt": "משולש",
    "district_state": "",
    "district_police": "",
    "event_date_raw": "29.12.2018",
    "event_date_iso": "2018-12-29",
    "death_date_raw": "29.12.18",
    "death_date_iso": "2018-12-29",
    "month_raw": "12",
    "month_num": 12,
    "incident_location": "קלנסווה",
    "exact_location": "",
    "solved_raw": "",
    "solved_status": "Unknown",
    "police_status": "",
    "weapon_raw": "ירי",
    "weapon_type": "Firearm",
    "weapon_detail": "",
    "firearm_involved": "Yes",
    "intent_raw": "",
    "background": "",
    "description": "",
    "notes": "",
    "source_url_1": "",
    "source_url_2": ""
  },
  {
    "record_uid": "2018-65-r72",
    "source_file": "פילוח קרבנות אלימות ופשיעה בחברה הערבית - 2018.csv",
    "source_row_number": 72,
    "dataset_year": 2018,
    "serial_number": "71",
    "record_group": "Main",
    "included_in_main_tally": true,
    "case_number": "65",
    "victim_name_he": "חוסאם אבו רגיס",
    "victim_name_ar": "",
    "age": 47,
    "age_group": "40-49",
    "gender_raw": "גבר",
    "gender": "Male",
    "citizen_raw": "",
    "citizen_status": "Unknown",
    "religion": "",
    "residence_locality": "שפרעם",
    "residence_locality_type": "",
    "residence_population_type": "",
    "geographic_area": "צפון",
    "geographic_area_alt": "גליל",
    "district_state": "",
    "district_police": "",
    "event_date_raw": "31.12.2018",
    "event_date_iso": "2018-12-31",
    "death_date_raw": "31.12.18",
    "death_date_iso": "2018-12-31",
    "month_raw": "12",
    "month_num": 12,
    "incident_location": "שפרעם",
    "exact_location": "",
    "solved_raw": "",
    "solved_status": "Unknown",
    "police_status": "ככל הנראה על רקע פלילי",
    "weapon_raw": "ירי",
    "weapon_type": "Firearm",
    "weapon_detail": "",
    "firearm_involved": "Yes",
    "intent_raw": "",
    "background": "",
    "description": "",
    "notes": "",
    "source_url_1": "",
    "source_url_2": ""
  },
  {
    "record_uid": "2019-1-r2",
    "source_file": "פילוח קרבנות אלימות ופשיעה בחברה הערבית - 2019.csv",
    "source_row_number": 2,
    "dataset_year": 2019,
    "serial_number": "1",
    "record_group": "Main",
    "included_in_main_tally": true,
    "case_number": "1",
    "victim_name_he": "סאהר חאלד מחאמיד",
    "victim_name_ar": "",
    "age": 19,
    "age_group": "18-24",
    "gender_raw": "גבר",
    "gender": "Male",
    "citizen_raw": "",
    "citizen_status": "Unknown",
    "religion": "מוסלמי",
    "residence_locality": "אום אלפחם",
    "residence_locality_type": "עיר",
    "residence_population_type": "יישוב ערבי",
    "geographic_area": "משולש",
    "geographic_area_alt": "",
    "district_state": "חוף",
    "district_police": "",
    "event_date_raw": "12.1.19",
    "event_date_iso": "2019-01-12",
    "death_date_raw": "12.1.19",
    "death_date_iso": "2019-01-12",
    "month_raw": "1",
    "month_num": 1,
    "incident_location": "אום אלפחם",
    "exact_location": "",
    "solved_raw": "כתב אישום",
    "solved_status": "Solved/Indicted",
    "police_status": "בחודש מרץ הוגשו שני כתבי אישום נגד ארבעה נאשמים בני משפחה מאום אל פחם, שלושה בגירים וקטין, המייחסים להם עבירות של רצח בכוונה תחילה, ניסיון לרצח ועבירות בנשק. זאת מאחר שהיה עד תביעה במשפט נגדם",
    "weapon_raw": "ירי",
    "weapon_type": "Firearm",
    "weapon_detail": "",
    "firearm_involved": "Yes",
    "intent_raw": "",
    "background": "",
    "description": "",
    "notes": "",
    "source_url_1": "",
    "source_url_2": ""
  },
  {
    "record_uid": "2019-2-r3",
    "source_file": "פילוח קרבנות אלימות ופשיעה בחברה הערבית - 2019.csv",
    "source_row_number": 3,
    "dataset_year": 2019,
    "serial_number": "2",
    "record_group": "Main",
    "included_in_main_tally": true,
    "case_number": "2",
    "victim_name_he": "עודי עבדאלחי",
    "victim_name_ar": "",
    "age": 27,
    "age_group": "25-29",
    "gender_raw": "גבר",
    "gender": "Male",
    "citizen_raw": "",
    "citizen_status": "Unknown",
    "religion": "מוסלמי",
    "residence_locality": "טירה",
    "residence_locality_type": "עיר",
    "residence_population_type": "יישוב ערבי",
    "geographic_area": "משולש",
    "geographic_area_alt": "",
    "district_state": "מרכז",
    "district_police": "",
    "event_date_raw": "15.1.19",
    "event_date_iso": "2019-01-15",
    "death_date_raw": "15.1.19",
    "death_date_iso": "2019-01-15",
    "month_raw": "1",
